;DATA;RATING;TITULO;REVIEW
0;27 de junho de 2021;50;Excelente lugar;Um lugar que não é só churrascaria, possui um bom cardápio de comida japonesa, atendimento de excelência, com boa variedade de frios e frutos do mar
1;1 de junho de 2021;50;Comemorando meu aniversário.;Excelente churrascaria, ótimo atendimento, comida ótima. Comemorei meu aniversário, e me deixaram muito feliz com o presente. Eu recomendo a Chimarron.
2;15 de maio de 2021;50;Melhor da cidade;Melhor comida japonesa , atendimento nota 10, arejada e espaçosa para a COVID 19.muita variedades. Parabéns.
3;9 de maio de 2021;50;Melhor rodízio;Ambiente familiar, mto aconchegante, excelente atendimento sem falar da comida. Sensacional. Ótimo rodízio
4;9 de maio de 2021;10;Falta de respeito com o cliente;Pedimos um almoço que ficou marcado de ser entregue as 13:00, mas a falta de respeito com o cliente e sempre maior. Não avisam que vão atrasar, e as 14:30 não chegou e simplesmente desligam o telefone. Merecem fechar pela falta de respeito
5;9 de maio de 2021;10;Atenciosamente negado;Horrível o atendimento Delivery. Fiz o pedido no sábado para ser entregue no domingo dia das mães (9/05/2021)para ser entregue às 12.30h esperei até as 13:30 E o pedido ñ foi entregue. Tentei ligar várias vezes e passar Whatsapp e não obtive resposta.
6;4 de maio de 2021;50;Maravilhoso !!!;Sempre sou muito bem atendidos e que equipe maravilhosa , todos muito atenciosos !! estão de parabéns !!
7;19 de abril de 2021;50;A melhor de Jf;Atendimento de excelência, carnes de primeira e sabor excepcional. Só elogios parabéns Chimarron!!!!
8;18 de março de 2021;50;De dar água na boca!!!;Excelente opção em Juiz de Fora, tanto para quem está de passagem pela BR 040 ou para quem está hospedado na cidade.
9;17 de março de 2021;10;Boa churrascaria! Já o delivery;Boa churrascaria! Já o delivery Deus me livre Acho que eles guardam carnes do dia anterior não sei ruim mesmo!
10;11 de março de 2021;50;excelente;tudo perfeito, ambiente limpo e higienizado, atendimento de primeira e tudo seguindo as normas de segurança e a comida e churrasco tudo delicioso, tudo de muito bom gosto.
11;3 de março de 2021;50;Rodízio no período da pandemia;Minha última visita foi a melhor experiência que tive, opções muito boas de saladas e frutos do mar, tudo maravilhoso. Gostei muito desse modelo de serviço e dos pratos servidos à mesa. O serviço é impecável, como sempre.
12;24 de fevereiro de 2021;50;Rodízio Churrascaria Chimarron;Ótimo atendimento, grande variedade, ambiente agradável e acolhedor! Recomendo o lugar e pretendo voltar mais vezes.
13;14 de fevereiro de 2021;50;Incomparável;Ótimo atendimento. carnes no espeto e em bifes, boi, porco e frango, tudo de primeira,Peixes: salmão, linguado e tilápia. Camarão, camarão ice, comida japonesa. Espaço dentro das normas da Convide 19, em pé, todos de máscara. Não tem igual num raio de 100 km
14;9 de fevereiro de 2021;50;Amei;Atendimento maravilhoso variedade de pratos e tudo muito limpo e organizado adorei tudo nessa churrascaria
15;4 de fevereiro de 2021;50;Excelente como sempre.;Irretocável. Não consigo provar tudo o que oferecem... Dá até uma tristeza ver um prato maravilhoso passando e a gente não conseguir comer mais...
16;13 de janeiro de 2021;50;Local maravilhoso!;Melhor churrascaria de Juiz de Fora. Rodízio com direito a tudo oque vc imaginar. Desde carnes nobres, japonês, peixes e o camarão de lá é um espetáculo à parte. Atendimento maravilhoso! Preço justo e ambiente nota 10.
17;7 de janeiro de 2021;50;Almoço agradável;Delicioso japa, carnes saborosas, mesa de saladas sortidas e bom atendimento, recomendo conhecer para comemorações e reuniões de negócios!
18;3 de janeiro de 2021;30;Churrasco Ok! (Melhor da cidade);A churrascaria não é nem de perto a melhor que já fui, mas também não é a pior, é a melhor da cidade, mas ainda tem muito o que melhorar...
19;14 de dezembro de 2020;50;Maravilhoso!;Ótimo atendimento, muito boa recepção e a comida melhor ainda! Muito boa mesmo! Eu super que recomendo!
20;10 de dezembro de 2020;50;Melhor Churrasco da Cidade;Ambiente excelente, tratamento irretocável, cordialidade, sabor e fartura. Desde o wc até a finalização da conta o serviço é impecável, comida japonesa de alta qualidade, saladas e diversos pratos proporcionam uma experiência gastronômica maravilhosa
21;7 de dezembro de 2020;40;Parada para almoço em viagem BH-RJ;Paramos na churrascaria no sábado a tarde para almoçar e saímos satisfeitos. Claro que, por conta do corona, o atendimento está totalmente diferente (o que é bom). Mas não nos faltou nada e fomos bem atendidos. As carnes também eram boas.
22;6 de dezembro de 2020;50;Otimo;Atendimento otimo, comida maravilhosa, ambiente super agradavel e garçons extremamente atenciosos...
23;30 de novembro de 2020;50;Melhor churrascaria;Amo tudo. Amo atendimento amo as comidas tudo perfeito . A comida japonesa esta sensacional. O arroz com bacalhau a tudo e perfeito
24;29 de novembro de 2020;50;qualidade com excelencia;Melhor churrascaria que já fui Voltando em juiz de fora pode ter certeza que retornarei a churrascaria chimarron
25;28 de novembro de 2020;50;Excelente;Boa refeição, lugar agradável, ótimo atendimento, sem igual, bom lugar para ir em família ou amigos.
26;28 de novembro de 2020;50;Comi até passar mal, ou seja, MUITO TOP.;Um ótimo atendimento, um ambiente super agradável e claro, o mais importante, uma comida maravilhosa!!! Ameiiii!
27;1 de novembro de 2020;50;Melhor lugar de JF;Espetacular o atendimento, buffet e o espaço. Melhor lugar que visitei em JF. Perfeito e aconchegante para um jantar a dois.
28;21 de setembro de 2020;50;Perfeito;Comida excelente e muito bem servida, pedimos delivery e chegou super rápido . Recomendo demais esse restaurante, no qual sempre temos boas experiências seja presencialmente ou pelo entrega.
29;23 de agosto de 2020;50;Maravilhoso, bom atendimento resumindo perfeito;Parabéns a equipe, todos de máscaras e um excelente atendimento, tudo muito bom! Os garçons muito preparados, a casa limpa, as carnes de primeira, um excelente atendimento, e uma qualidade impecável! Parabéns a todos
30;12 de agosto de 2020;50;Perfeito;Adorei conhecer a churrascaria chimarron, gostei muito do atendimento e da recepção! Essa equipe está de parabéns! Fui muito bem recebida, e Com certeza voltarei mas vezes.
31;10 de agosto de 2020;50;fantástico;Excelente estabelecimento! Exemplo a ser seguido pelos outros bares e restaurantes de juiz de fora - MG. Super indico as todas as pessoas que querem comida boa, ambiente salutar e aconchegante. Parabéns!
32;4 de agosto de 2020;50;Atendimento mais do que perfeito.;Os produtos ofertados são de excelente qualidade, bem como, o atendimento perfeito. Cordial e muito educado. Não ficamos em momento algum sem sermos servidos. Tudo perfeito. Sempre que possível estarei por aí.
33;17 de julho de 2020;10;Comida delivery deixou a desejar;A carne parece q foi cozida no banho Maria, não tinha nenhuma maciez e não estava no ponto que eu pedi. Espero que melhorem a qualidade.
34;9 de julho de 2020;50;Excelente Restaurante;Excelente Restaurante, com um ótimo cardápio e com uma variedade muito grande em carnes, com certeza o melhor de Juíz de Fora
35;16 de junho de 2020;30;Atendimento bufe;O serviço de self service foi substituído por servirem nas mesas ( por causa da pandemia. Correto ) com isso o atendimento ficou muito a desejar.
36;9 de junho de 2020;40;Experiencia;Já visitei a churrascaria algumas vezes e fui melhor atendido. Mas deixo registrado que devido a pandemia estão funcionando com ambiente reduzido. Comida de ótima qualidade sem contar a carne e casquinha de Siri.
37;20 de abril de 2020;50;Ótimo atendimento;, comida Maravilhosa , ambiente adorável e aconchegante, recepção maravilhosa. Ambiente familiar e super organizado com funcionários super educados!
38;20 de março de 2020;50;Ótimo atendimento;Excelente como sempre,Funcionarios competentes,Educados,recomendo e no dia estava mais vazio...Excepional... Fomos muito bem atendidos... 🙌🙌🙌🙌🙌🙌🙌🙌🙌🙌🙌🙌
39;17 de março de 2020;50;Excelente;Atendimento nota mil. Todos os garçons muito atenciosos, comida de qualidade e boa variedade. Localização ótima.
40;16 de março de 2020;50;Excelente ambiente e atendimento;Ambiente super acolhedor e atendimento excelente. Variedades de comidas, que atende todos os tipos de estilo de vida e alimentação.
41;16 de março de 2020;50;Excelente mas caro!;Muíto bom, o preço aumentou muito em pouco tempo mas vale a pena! O atendimento é espetacular! E sempre muito rápido para mesas e o espaço kids é o mais top de todos!
42;12 de março de 2020;50;Amei;Nossa fui muito bem recebida adorei♥️ , meus convidados adoraram o serviço e o atendimento de vcs muito obrigado
43;9 de março de 2020;50;Melhor churrascaria da cidade!!!;Melhor churrascaria de Juiz de Fora!!!! Muita variedade de carnes, saladas, queijos, frios, comida japonesa. Atendimento simpático e eficiente.
44;8 de março de 2020;50;Lugar maravilhoso;Melhor churrascaria de Juiz de Fora. Comidas muito gostosas, carnes selecionadas, ambiente agradabilíssimo.
45;6 de março de 2020;50;Melhor de Juiz de Fora;Penso ser a melhor Churrascaria de Juiz de Fora, apesar de termos poucas opções boas na cidade neste seguimento.
46;5 de março de 2020;50;Aniversario do filho;Atendimento 10, ambiente agradável, comida excelente, tudo maravilhosamemte maravilhoso. Super indico!
47;21 de fevereiro de 2020;50;Gosto bastante!;recomendo servir mais carne de caça, mais opções de cortes argentinos, passar filé mignon e picanha com mais frequência e tirar a casca do camarão salteado do self service.
48;19 de fevereiro de 2020;50;Encontro perfeito;Atendimento excelente funcionarios simpáticos e preocupados com a satisfacao do cliente ,a área recreativa tambem com uma excelente funcionaria e muito atenciosa
49;15 de fevereiro de 2020;50;Almoço aos domingos;Excelente opção para almoço em família. Boa estrutura para crianças de todas as idéies é bom atendimento.
50;13 de fevereiro de 2020;40;Churrascaria com excelente atendimento.;Muito bom! atendimento e local bem trabalhados.Carnes bem variadas, mas não muito extravagantes (para quem gosta), porem bem feitas e os garçons ficam preocupados em te agradar com o seu gosto para o tipo de carne.
51;11 de fevereiro de 2020;50;Muito bom, mas não um dos melhores restaurantes de carne que ja fui;Churrasco excelente, mas poderia ser melhor um pouco para acompanhar o valor cobrado pois tem um espaço muito bem elaborado, vários garços (o que realmente ajuda na fartura quando se trata de um rodizio.
52;11 de fevereiro de 2020;50;Deliiiiiiicia!!!;Carnes nobres, deliciosas e comida japonesa também muito top.... Super indico... Ambiente agradável..
53;10 de fevereiro de 2020;50;Excepcionall;Atendimento muito bem estruturado, refeições excelentes, lugar muito harmonioso para se estar com amigos e família
54;10 de fevereiro de 2020;50;Maravilhoso lugar.;Fui muito bem atendida por todos. Voltarei mais vezes. Ambiente climatizado e agradável. Garçons simpáticos e educados.
55;8 de fevereiro de 2020;50;Melhor churrascaria da região;Ambiente agradável, com excelente atendimento, carnes nobres e buffet variado, preço condizente c o serviço oferecido
56;31 de janeiro de 2020;50;Satisfação em muitos quesitos.;Ambiente muito agradável, com comida gostosa, climatização adequada, iluminação e decoração interessantes, bom atendimento por parte dos funcionários, banheiro muito bem equipado.. Enfim, ir ao Chimarron é um bela experiência. Eu e minha família estamos satisfeitos.
57;28 de janeiro de 2020;50;Muito boa;A churrascaria realmente é muito boa, possui comida japonesa tudo fresco. Boa variedade no bife... Voltarei muitas vezes.
58;28 de janeiro de 2020;50;A melhor de jf;Pessoas atenciosas, ambiente familiar e o melhor perto de casa , devo voltar no meu aniversário,31/01/20
59;26 de janeiro de 2020;50;Merece o 1o lugar de Juiz;Merece o 1o lugar de Juiz de Fora certamente! A Chimarron na minha opinião está cada vez melhor! Atendimento cordial do início ao fim, carnes excelentes, japonês saboroso e mesa de frios e acompanhamentos com muitas opções!!! Eu amo!
60;25 de janeiro de 2020;50;Atendimento ótimo;Ótimo atendimento e carnes especiais . Uma das melhores churrascarias do Brasil. Supera várias que já visitei no Rio de Janeiro, Belo Horizonte, Florianópolis e São Paulo.
61;25 de janeiro de 2020;50;Espetacular;Local maravilhoso, atendimento excelente, principalmente os garçons. Recreação nota 1000. Sobre o cardápio não tenho palavras para descrever! 0 defeitos.
62;24 de janeiro de 2020;50;chimarron é muito bom;ótimo atendimento, ótima comida, um bifê bem variado, piso e banheiro muto bem limpos. sempre que eu tiver oportunidade indico e vou a esse estabelecimento.
63;22 de janeiro de 2020;50;Ótimo;Parabéns Chimarrom, pelo excelente atendimento ,pela dedicação de nós proporcionar um ambiente acolhedor e agradável a todos ,só carinho com nossos filhos. Obrigada
64;17 de janeiro de 2020;50;A melhor de JF;Top! A melhor de JF!!!Primeira vez que fui e me senti maravilhada com tudo! Educação dos funcionários nota mil!
65;16 de janeiro de 2020;50;Melhor churrascaria.;É uma churrascaria excelente. Um atendimento maravilhoso, não tem igual.. A comida então nem se fala.
66;15 de janeiro de 2020;40;Maravilha;Lugar para se comemorarmos familiares e amigos todos os tipos de ocasiões. Vale cada centavo que se paga. Atendimento da equipe é nota 10.
67;13 de janeiro de 2020;50;Dia Maravilhoso;Continue assim com a mesma excelência e atenção ao atendimento aos clientes....Lugar perfeito e aconchegante
68;12 de janeiro de 2020;50;Churrascaria com muita variedade;Churrascaria com muita variedade e excelente qualidade das carnes servidas. Vale a pena provar o cowboy.Destaque para a cozinha de comida japonesa
69;9 de janeiro de 2020;50;Perfeito!!!;Carnes excelentes. Cowboy steak com molho chimichurri é coisa divina. Menção honrosa ao César e ao Rodrigo, dois garçons excelentes.
70;8 de janeiro de 2020;40;Melhor churrascaria da cidade;Rodízio de carnes de qualidade e muito completo que ainda conta com comida japonesa e uma mesa de frios de primeira.
71;7 de janeiro de 2020;50;Impecável;Rodízio alta qualidade e excelente atendimento . Preço que poderia ser um pouco menor para a região . Mas altíssima qualidade .
72;6 de janeiro de 2020;50;Melhor churrascaria de JF;Excelente serviço de rodízio, com opção de pedidos personalizados, como camarões, filé mignon e outros. O valor cobrado pela taxa de rolha é um pouco alto, mas o serviço justifica.
73;3 de janeiro de 2020;50;Excelente;Impecável. Atendimento e qualidade excelente! Obrigada por ter me proporcionado um ótimo aniversário de namoro. Parabéns Chimarron Churrascaria.
74;3 de janeiro de 2020;30;Muito sal;comida boa. mas muito salgada(Muito mesmo). O que estava mais salgado era a comida japonesa. nuca vi comida japonesa salgada.
75;2 de janeiro de 2020;30;Muito bom!;O atendimento é sempre muito bom, porém no dia em questão a carne estava muito salgada. Dessa vez ficou devendo.
76;28 de dezembro de 2019;50;Nota mil;Excelente lugar, atendimento impecável, garçons prestativos e simpáticos, além das carnes e iguarias excepcionais.
77;27 de dezembro de 2019;50;Melhor Churrascaria da Região;Adorei o espaço recreativo para meus filhotes, ambiente que agrada as crianças sempre são os melhores.
78;26 de dezembro de 2019;50;Melhor atendimento de todos!;Enquanto nos deliciamos com seu espetacular rodízio, podemos deixar nossos filhos com as recreadores
79;23 de dezembro de 2019;50;Atendimento com excelência.;Venho de outro estado e me surpreendeu a forma e simpátia de todos. Estão de parabéns, desde as meninas da higienização até os gerentes (s).
80;22 de dezembro de 2019;50;Experiência perfeita;Aquele lugar que você vai e não se preocupa com mais nada Atendimento impecavel, comida esplendida!!
81;19 de dezembro de 2019;50;Melhor restaurante!!!;É o melhor restaurante que já fui. O atendimento é excelente! Comida maravilhosa! E muito bem localizado.
82;17 de dezembro de 2019;50;Exelente;Excelente atendimento, qualidade em tudo! Ótimos funcionários e excelente buffet! Sempre faço minhas comemorações com vcs!
83;16 de dezembro de 2019;50;Top;Muito Maravilhosa, Gostamos muito, estava tudo ótimo, atendimento, comida, voltaremos sempre que a gente estiver em Juiz de Fora. Todo dezembro estaremos aí para a formatura e sempre voltaremos se Deus quiser. Grata
84;16 de dezembro de 2019;50;MELHOR CHURRASCARIA DO UNIVERSO!;Muita variedade de carnes, frios e bebidas. excelente atendimento, ambiente confortável. O melhor café com chantili do planeta!!!!
85;13 de dezembro de 2019;50;Nota 10!;Serviço impecável! Comida perfeita! Somos sempre surpreendidos com iguarias. Pedi cortes diferentes e fui atendido. Gostei muito recomendo!
86;13 de dezembro de 2019;50;ATENDIMENTO E COMIDA DE QUALIDADE;Perfeito! Desde que chegamos fomos bem recebidos, a espera foi super rápida. Os garçons e recepcionistas foram muito atenciosos em tudo que precisamos.
87;12 de dezembro de 2019;50;PERFEITO;atendimento, sabor, cortes de carnes maravilhos. melhor churrascaria de juiz de fora. isso sem mencionar as sobremesas. tudo perfeito!
88;11 de dezembro de 2019;50;Perfeito;Atendimento excelente, garçons super simpaticos e variedade para agradar a todos. Estive aí para mais um ano confraternizar com a minha equipe de trabalho e todos saímos super satisfeitos.
89;8 de dezembro de 2019;50;Muito top,;o sushi pra mim e o melhor, atendimento sensacional, várias opções para comer, recomento todo mundo ir
90;8 de dezembro de 2019;50;Delicioso;Muito atenciosos, atendimento rápido, eficiência, muito saboroso, tudo muito gostoso. Gostei muito de ter ido, todos nós gostamos.
91;8 de dezembro de 2019;50;"Em uma só palavra: ""Perfeição""";Perfeição é a avaliação da Chimarron, da recepção até a saída. Sem dúvida alguma foi a melhor churrascaria que visitei por onde passei no Brasil e não foram poucos ou lugares.
92;8 de dezembro de 2019;50;Magnífico;Lugar incrível, com estacionamento grátis. A melhor comida japonesa da região e o churrasco eu nem vou comentar. Simplesmente maravilhoso!
93;4 de dezembro de 2019;40;AVALIACAO NOV 2019;Atendimento excelente. Buffet de salada bastante variado. Japonês também de boa qualidade. As carnes estavam deliciosas, um pouco salgadas, mas ótimas!
94;2 de dezembro de 2019;50;Ótimo;Ótimo churrasco. Fechamento com uma taça de sorvete de baunilha com banana e doce de leite. Muito bom
95;2 de dezembro de 2019;50;Melhor churrascaria de Juiz de Fora;Excelente atendimento, excelente comida, sempre que vou a Juiz de Fora vou ao Chimarron! Obrigado pelo serviço prestado!
96;1 de dezembro de 2019;50;Sensacional;Estrutura muito bem distribuída, os funcionários sempre bem alinhados, muito bem educados, e o principal, as carnes divinas, que sabor.....vcs estão de parabéns !!!!
97;29 de novembro de 2019;50;Ótimo estabelecimento;Ótimo ambiente, garçons muito educado e prestativo, todos estão de parabéns, espero voltar mais vezes com minha família!!
98;28 de novembro de 2019;50;avaliação geral;ótimo atendimento,com excelente localização. cardápio com muitas opções e de excelente qualidade,sabor sem igual!
99;27 de novembro de 2019;50;TODOS;Muito bem atendida , pratos deliciosos estao de parabens ! Garcons atenciosos, espero voltar em breve.
100;26 de novembro de 2019;50;Melhor churrascaria de juiz de fora.;Muito bom o atendimento, e variedade de carnes. Excelente localização, pretendo voltar outras vezes. Índico a outras pessoas.
101;26 de novembro de 2019;50;Super Indico;Fui com familia comemorar meu Niver. O local e o ambiente são otimos, atendimento nota 10, tudo de excelente qualidade!
102;24 de novembro de 2019;50;Excelente ambiente!;Recomendo a todos conhecer e saborear suas carnes e bufê!Lugar agradável e aconchegante, ótimos funcionários ,todos muito perceptíveis.
103;23 de novembro de 2019;50;Sempre uma excelente opção.;Lugar agradável, comida de primeira e o atendimento sempre nota mil. Meu único questionamento é o valor cobrado p as crianças, deveria ser menor.
104;22 de novembro de 2019;50;Experiência excelente;Já conhecia a Churrascaria Chimarron de Petrópolis e fiquei muito contente em poder ter em Juiz de Fora a mesma qualidade e atendimento .
105;22 de novembro de 2019;40;Churrascaria muito boa!;Churrascaria de bom padrão, qualidade de produtos e atendimento. Sessão de frios deliciosos e frescos. Vale conferir!
106;18 de novembro de 2019;50;sempre top;desde a chegada ate ir embora funcionarios super atenciosos, comida perfeita como sempre e cerveja gelada
107;18 de novembro de 2019;50;Tudo ótimo;Fui muito bem atendida eu e meu esposo , amei a recepção. fora as outras coisas como a mesa de frio e as variadas tipos de carnes , tudo uma delícia .
108;18 de novembro de 2019;50;Muito bom atendimento!;Gostei muito do atendimento , fui muito bem atendida, a comida estava excelente! Muito Obrigada!!!!!
109;18 de novembro de 2019;50;comemorando meu niver;otima equipe, muito simpaticos e atenciosos, serviço de otima qualidade, tudo muito gostoso, tive uma noite muito agradavel
110;18 de novembro de 2019;50;Churrascaria nota dez;"Uma churrascaria de grande variedade de carnes, frios, sushis, sobremesas .. ""excelente"". Atendimento dos garçons de alto nível."
111;8 de novembro de 2019;50;Lugar nota 10;Atendimento excelente,garçons e supervisores atenciosos, lugar limpo, ambiente super agradavel, estacionamento no local, elevador para pessoas com necessidades especiais
112;8 de novembro de 2019;50;Excelente;Atendimento perfeito, ambiente climatizado e a comida nem se fala, uma delícia. Funcionários solícitos e estacionamento coberto.
113;8 de novembro de 2019;50;Japonês delicioso!;Prefiro a comida japonesa à noite, e estava tudo delicioso, fresquinho e além de ter chegado rápido!
114;7 de novembro de 2019;50;Comida excelente;Garçons educados e atenciosos, comida boa e rodízio com bastante variedade, e ambiente limpo. Excelente!
115;7 de novembro de 2019;40;Japonês;Fiz um pedido na comanda de japonês e faltaram os sashimis , que é o que mais gosto na culinária japonesa. No resto foi bom.
116;5 de novembro de 2019;50;Excelente;Ambiente mais do q agradável...atendimento excelente...profissionais preparados para atender....gerente capacitado e sempre a seu dispor
117;5 de novembro de 2019;40;Carne boa com muita variedade;Fomos comemorar o aniversário do meu irmão. A família toda adorou a comida. O preço é bastante alto, especialmente para crianças, mas valeu a pena.
118;5 de novembro de 2019;40;Muito boa churrascaria;Churrascaria muito boa e com um atendimento muito qualificado. Boa diversidade de carnes porém mantém o tradicional.
119;4 de novembro de 2019;40;Muito bom mas extremamente caro !!;Muito bom o rodízio, mas o custo beneficio não vale a pena. Muito caro o rodízio R$ 89,90. Não vale isso tudo !!
120;3 de novembro de 2019;50;exelente;Fomos muito bem servidos, garçons bem educados, gerencia sempre vinha em nossa mesa, atendimento ótimo, voltarei mais vezes, obrigada.
121;28 de outubro de 2019;50;Rodízio Chimarron;Ambiente, comida e atendimentos excelentes como sempre!!! Melhor restaurante de Juiz de Fora!!! Todas as ocasiões especiais, estamos lá!
122;28 de outubro de 2019;50;Agradável;Tradicionalmente churrascaria. Aquele protocolo de churrascaria mas com a carne bem feita e saborosa
123;28 de outubro de 2019;50;Excelente!;"O quadro de funcionários da empresa é especial; a carta de vinhos maravilhosa e as carnes excelentes!!! Em nossa região posso afirmar com toda certeza é a melhor..."
124;28 de outubro de 2019;50;excelente;comida boa, atendimento rápido, da recepcionista ao garçom tudo de bom, comida japonesa de primeira, as carnes são a excelencia.
125;25 de outubro de 2019;40;Muito com o atendimento;Notei que tem alguns garçons novos na equipe, gostei muito do atendimento. Continuem assim melhorando cada vez mais
126;24 de outubro de 2019;40;Muito bom;Ressalto somente que, o japonês não foi os que pedimos e algumas peças não estavam tão frescas e não confeccionada do modo que deveria... No mais tudo muito perfeito como sempre
127;22 de outubro de 2019;50;Excelente!;Local bem bonito, agradável, funcionários educados e prestativos! E o que mais importa: a comida é muito boa, bastante variedade e gostosa!
128;21 de outubro de 2019;40;trabalho;de maneira geral foi muito boa. atendimento pode melhorar um pouco em relacao as carnes especificas e sobremesas.
129;20 de outubro de 2019;50;Excelente churrascaria;Carnes ótimas e comida japonesa muito boa. Ambiente agradável,bom espaço para recreação e atendimento muito atencioso
130;19 de outubro de 2019;50;Paraíso gastronomico;Atendimento impecável, carnes maravilhosas e ambiente aconchegante, melhor lugar para saborear um churrasco de qualidade.
131;18 de outubro de 2019;50;Grata surpresa;Agora com acessibilidade via elevador. Carnes e acompanhamentos muito bem preparados. Atendimento eficiente.
132;15 de outubro de 2019;50;Excelente churrasco;Uma das melhores churrascaria que já fui. Várias opções de carnes. O molho de maracujá no salmão é sensacional.
133;15 de outubro de 2019;50;Restaurante fabuloso!;Ótimo atendimento. Garçons educados e atenciosos. Estrutura excelente, inclusive para cadeirantes. Buffet variado e muito bem servido.
