;DATA;RATING;TITULO;REVIEW
399;23 de novembro de 2018;40;VARIEDADE;Clima agradável,com excelente variedade de comidas e ambiente extremamente limpo.Deixa a desejar no atendimento.
400;23 de novembro de 2018;50;LUGAR FANTÁSTICO!;Clima agradável e aconchegante, recepção simpática e competente e comida ótima.Diante desses fatos, é impossível avaliar com uma nota menor!!
401;22 de novembro de 2018;50;sensacional;eu amo ir neste lugar .otimo atentimento ,pessoal muito atencioso e sem contar a que e cheio coisas gostosas.
402;22 de novembro de 2018;50;Nota 10;Ambiente agradável, funcionários extremamente agradáveis e educados, comida excelente com certeza super indico!!
403;21 de novembro de 2018;40;Bom rodízio;Da pra comer muito e bem! Carne de qualidade e bom atendimento. Buffet variado. Boa pedida para almoço descontraido.
404;21 de novembro de 2018;50;Melhor de JF e Região!;Desde a reserva ao atendimento, tudo foi perfeito! A comida de um modo geral é espetacular! As carnes sempre muito boas! Impossível não ficar satisfeito! Já fui várias vezes e retornarei muitas outras com certeza!
405;20 de novembro de 2018;40;Atendimento diferenciado;Churrascaria com ótimo atendimento e ótimas opções de carne. Contam com sushiman para pedidos na mesa. Buffet normal, sem grandes novidades. Preço dentro da média.
406;20 de novembro de 2018;50;Lugar agradável;atendimento excelente, produtos de qualidade, ambiente confortável e agradável, variedade de produtos.Amei a comida japonesa.
407;20 de novembro de 2018;50;Satisfação;Sempre que tenho a oportunidade, vou a Chimarrom. Atendimento maravilhoso, pessoas educadíssimas, comida deliciosa e muita variedade! Atende qualquer ocasião! Ja estou pensando na próxima ida rsrs
408;19 de novembro de 2018;50;ótima;ótima,os atendentes são de primeira categoria sempre pronto a ajudar,a aréa de recreação para crianças top
409;9 de novembro de 2018;40;Ótima churrascaria;Buffet variado, ambiente agradável, bom serviço. Uma sugestão seria introduzir algo para crianças maiores, a brinquedoteca é bem reduzida!
410;8 de novembro de 2018;50;EXCELENTE;Ambiente sofisticado, comida boa, atendimento visando o cliente, ambiente kids. muito bom recomendo.
411;6 de novembro de 2018;40;Melhor churrascaria de Juiz de Fora;Melhor churrascaria de Juiz de Fora! Preço acima da média de JF, mas abaixo de outras cidades grandes. Ótimas opções de carne, culinária japonesa e mesa de frios. Ótima opção para um rodízio!
412;6 de novembro de 2018;40;Uma das melhores da cidade;Ótima churrascaria ! Tem carnes de mal a bem passadas, sem que lhe obrigue a comê-las sempre no mesmo ponto. O valor é bem salgado, mas a qualidade é muito alta. Em geral, muito boa experiência.
413;6 de novembro de 2018;50;Jantar;Exelente atendimento bom espaço kids muito agradavél comida boa,so a bebida que um pouco puxada...mas o restante e muito bom👏👏
414;6 de novembro de 2018;30;Muito cheio !;"No dia que fui aguardei na fila por 30 minutos e não consegui entrar. O problema não foi estar cheio, mas o atendimento que recebi, a atendente disse que ""rapidinho"" eu poderia entrar, mas depois de 30 minutos eu desisti !"
415;6 de novembro de 2018;50;Excelente!;Bom atendimento e comida excepcional, recomendo a quem queira comemorar um dia especial com a familia.
416;6 de novembro de 2018;50;uma ótima opção;O melhor lugar que encontrei na cidade, 16 de dezembro voltarei la para comemorar meu aniversário! Podem me aguardar, estarei lá! Obrigado pelo conforto.
417;6 de novembro de 2018;50;Ótimo atendimento garçons muito bem treinados e atenciosos com os clientes , comida muita boa de altíssima qualidade !!;atendimento garçons muito bem treinados e atenciosos com os clientes , comida muita boa de altíssima qualidade !! Recomendo !!!
418;4 de novembro de 2018;50;Cliente satisfeita;Otimo o atendimento tudo muito bom😉🤗 a comida as carnes o acompanhamentos tudo perfeito continue assim!!
419;29 de outubro de 2018;50;Excelente;Tudo perfeito de extremo bom gosto, cardápio variado extremamente satisfatório, valeu a pena experimentar cada peça oferecida, junto ao ótimo atendimento e ambiente tranquilo
420;29 de outubro de 2018;50;Comer bem!;Quer um lugar para comer bem, vá a chimarron! Sempre saio muito satisfeita com a qualidade e o sabor da comida! Local com espaço kids otimo para as crianças. Almoce tranquilo enquanto as criancas se distraem.
421;29 de outubro de 2018;40;Chimarron Churrascaria;Boa opção em churrascaria em Juiz de Fora (Minas Gerais) oferecendo rodízio de carnes e cervejas e chopps.
422;25 de outubro de 2018;30;Fraca;Não chegou nem perto de superar as minhas expectativas, tem outros locais na região com preços mais acessíveis.Pelo preço pago não vi nenhum diferencial.
423;25 de outubro de 2018;30;Pouca variedade!!;Mesa de frios com pouca variedade, pouca variedade de carne, o dia em que eu fui não estava nada legal!
424;23 de outubro de 2018;50;Super recomendo;Lugar agradável, comida maravilhosa, funcionários educados e preparados para atendimento par atendimento de excelência!
425;22 de outubro de 2018;50;Estabelecimento nota 10!!!!;Ambiente aconchegante,variedades de buffet, carnes nobres... excelente!!!Já sou frequentador do lugar e pretendo voltar várias vezes.
426;15 de outubro de 2018;50;Melhor churrasco;Carnes bem selecionadas e no ponto q vc pede. Ambiente agradável e um ótimo atendimento. Tem espaço kids, p quem tem criança ajuda muito. Só poderia ter um chopp de melhor qualidade.
427;15 de outubro de 2018;50;Muito bom;Ótimo rodízio, diversas opções. Comida saborosa, ambiente agradável. Boa localização. Super recomendo.
428;14 de outubro de 2018;50;Excelente custo benefício;Local de fácil acesso, estacionamento grátis pra clientes (Bahamas abaixo da loja), muitas opções de carne, mesa de frios e peixes. Não chega a competir com as de RJ e SP, mas o preço muito menor, então vale muito a pena.
429;14 de outubro de 2018;50;Recomendo;Atendimento, churrasco e complemento saborosos. Bem localizado próximo ao centro de Juiz de Fora. Recomendo.
430;13 de outubro de 2018;50;Excelente;Melhor comida , ótimo atendimento , espaço Kids com monitora educada e dedicada e carinhosa . Ótimo Japa!!!
431;12 de outubro de 2018;40;Rodízio com variedade e qualidade;Minha família prefere o rodízio tradicional. Eu opto pela comida japonesa, com destaque para o Monte Fuji. Todos saímos satisfeitos
432;11 de outubro de 2018;50;Excelente;A comida é maravilhosa, o atendimento sensacional. Não fiquei nem um minuto sem ser servida. A preocupação de todos os funcionários com nosso bem estar o tempo todo é sensacional.
433;11 de outubro de 2018;30;Comemoração de aniversario;O serviço é muito bom e os produtos oferecidos são de ótima qualidade. Só queria, como aniversariante e visitante da cidade, mais atenção e um brinde.rsrs
434;8 de outubro de 2018;50;Competência;Achei toda a equipe muito bem preparada para o atendimento ao público. Atendimento maravilhoso e o rodizio perfeito.
435;8 de outubro de 2018;50;Espetacular como Sempre;A melhor de JF, atendimento e variedade sem igual! Vale a pena, é muito bom. Sem falar na cerveja de garrafa
436;6 de outubro de 2018;50;Bom atendimento;A Churrascaria Chimarron foi escolhida por nós para comemorar o aniversário de um familiar e fomos muito bem atendidos. Recomendo.
437;4 de outubro de 2018;50;Ótimo;Tudo ótimo , atendimento maravilhoso e comidas então sem nada a reclamar. Indico muito para todos !!!
438;4 de outubro de 2018;50;Fenomenal!!!;Excelente serviço e atendimento impecável. Sou fã da casa. Vou sempre que estou em JF.Imperdível!! Não troco por outro local para comer bem e com qualidade.
439;3 de outubro de 2018;40;Boa localização e serviço - Preço razoável;Ambiente em segundo pavimento, com boa vista, bom serviço. Destaque para o shouder steak e a maminha argentina - estavam excelentes. O preço é razoável - como em todos rodízios, vale mais a pena se estiver com apetite.
440;3 de outubro de 2018;50;Excelente;Melhor churrascaria da cidade, disparado! Carnes de ótimo qualidade e comida japonesa super bem feita.
441;3 de outubro de 2018;50;recomendo;excelente. gostaria de receber cupons de desconto para que possa comparecer mais vezes.Qualidade incontestável dos alimentos, atendimento prestativo e educado, além de saborosa comida
442;3 de outubro de 2018;50;Excelência;Melhor churrascaria de juiz de fora!carnes da melhor qualidade, atendimento de primeira, recomendo a todos!
443;2 de outubro de 2018;50;Bom demais!!!!;Atendimento maravilhoso comida melhor ainda!!!! Não tem nada ruim lá recomendo a todos pq é bom demais!!!!!!!!
444;2 de outubro de 2018;50;Comemoração de aniversario em família. Destque: comida japonesa incluída no rodízio.;Fomos em família para comemorar aniversário. Fomos muito bem atendidos. Comida de excelente qualidade e bastante variada. Sistema de Rodízio. Oferece ainda comida japonesa.
445;2 de outubro de 2018;50;Bom apetite!!;Excelente local! Para os amantes de churrasco é uma ótima pedida. Aconpanhamentos variados e de deliciosos. Vale conferir!!!
446;2 de outubro de 2018;50;Chimarron;Gosto muito de almoçar no Chimarron. E é até engraçado porque não como carne. Mas tem muita opção gostosa.
447;2 de outubro de 2018;50;Passeio;Pra mim à melhor da cidade ,eu recomendo ótima localização estacionamento grátis boas acomodações vale à pena conferir.
448;2 de outubro de 2018;50;não variam o bife;Faltam alguns cortes nobres de carne, tais como carneiro, picanha nobre, arros com polvo e camarão, bisteca, chuleta,, coisas desse tipo, dai também não sei se o preço continuaria comodo como e
449;2 de outubro de 2018;30;Normal;Chimarron é uma churrascaria como todas,garçons servindo sempre,educadissimos,bem apresentados o único porém é o ambiente que achei escuro,iluminação fraquinha.No mais a comida é ótima e saborosa
450;30 de setembro de 2018;40;Rodízio durante almoço.;Local de excelente qualidade, com espaço amplo, bonito, muito organizado. Eu e minha esposa almoçamos o rodízio de comida japonesa, que consideramos de ótimo gosto. O preço sai salgado para uma refeição de durante a semana, porém fomos lá já cientes disso.
451;30 de setembro de 2018;50;Alto padrão;Sempre vou!! Comida maravilhosa,carnes deliciosas e de qualidade, funcionários extremamente solícitos. Custo alto, porém vale a pena.
452;27 de setembro de 2018;50;Perfeita;Nada a reclamar ou acrescentar. Comida muito saborosa, atendimento excelente de todos os funcionários.
453;27 de setembro de 2018;40;Churrasqueira Top na Cidade;Muito bom serviço. Gostei particularmente das entradas. Tinha uma variedade enorme de entradas, em que não havia restricões ao número de repeticões.
454;25 de setembro de 2018;50;Dia especial;Primeira vez que fui com minha família, todos gostaram muito, excelente atendimento, otima refeição. Parabéns, em breve estaremos visitando novamente.
455;25 de setembro de 2018;50;A número 1 em juiz de fora;Excelência em tudo, atendimento, pratos, ambiente, sabores, especiarias localização e comodidade para todos.
456;25 de setembro de 2018;40;Ótimo;Ótimo rodízio, possui cortes argentinos e japonês incluído no rodízio. Garçoms muito educados,vale muito a pena conferir o lugar
457;24 de setembro de 2018;40;Ótimo local;Bom local, comida bem feita porém a fila e bem grande nos horários de pico do almoço do final de semana. O espaço e bem limitado. Vale a pena.
458;24 de setembro de 2018;30;Já foi melhor;Frequento a chimarron a um bom tempo. A qualidade vem caindo, comi esse FDS e não achei nada demais.
459;20 de setembro de 2018;50;Tudo perfeito;Volto mais vezes com certeza, recomendo. Excelente atendimento e ambiente muito agradável. A melhor de JF.
460;19 de setembro de 2018;50;Maravilhoso;Pessoal !. E simplesmente maravilhoso. Toda vez que vou, fico satisfeito com tudo. Atendimento,a simpatia dos atendentes. Espero que todos vocês tenha a oportunidade de esta neste lugar..abraço ,
461;19 de setembro de 2018;50;uma delicia;bom atendimento como a muito tempo nao estava tendo na chimarrum.A carne estava bem gostosa o salmom poderia ser um pouco mas passado, mas tava bom .
462;18 de setembro de 2018;50;Bom demais;Foi muito bom,Baltar eu outras vezes.E vou indicar meus melhores amigos para ir , comemorar seus aniversários
463;18 de setembro de 2018;50;A top!;Atendimento excelente, rodízio top com fartura,Muitas opções de acompanhamentos...Simpatia e presteza da equipe de atendimento e garçons!
464;18 de setembro de 2018;50;EXCELENTE;Tudo foi perfeito desde a comida ate o bom atendimento dos garçons. Não deixam você sem atenção. As comidas japonesas são maravilhosas
465;17 de setembro de 2018;50;Atendimento espetacular;Além de pratos regulares em uma churrascaria, existem várias outras opções.Tudo com muita higiene e qualidade
466;15 de setembro de 2018;50;A melhor;A Chimarron se mantém firme no posto de ser a melhor churrascaria da cidade. O atendimento é perfeito e simpático, o menu perfeito e a qualidade é a meta da casa.
467;13 de setembro de 2018;50;Chimarrom 10;Lugar maravilhoso! Atendimento 10! Buffet 10! Ambiente 10! Limpeza 10! Simpatia 10! Juiz de Fora 10!
468;12 de setembro de 2018;50;Excelente Restaurante;Local ótimo para ir com a família! Toda vez que vou, me surpreendo com algo diferente. A comida é ótima e o atendimento é impecável! Estão de parabéns.
469;12 de setembro de 2018;50;A melhor da melhor;otimo atendimento, nao tenho nada a reclamar , pena que nao posso ir todos os dias. Mas todo mes estou la sempre presente, obrigado ai pelo conforto, parabens.
470;12 de setembro de 2018;50;excelente;Atendimento de excelência, tudo servido muito rápido e muita diversidade. Recomendo todos a visitar.
471;9 de setembro de 2018;50;Sempre bom;Sempre bom poder desfrutar desse rodizio que para mim um dos melhores que se pode achar. Deu ate vontade fazendo essa avaliacao.
472;8 de setembro de 2018;50;Funcionários muito atenciosos!;Churrascaria de primeiríssima qualidade. Cortes de carnes muito bons. Excelente atendimento de garçons e gerência!!
473;5 de setembro de 2018;50;Agradecimento!;Eu e meu noivo agradecemos pela recepção e pelo atendimento. Ficamos satisfeitos pelo ótimo trabalho e total desempenho!
474;4 de setembro de 2018;40;Boa;Sempre vou a Chimarrom pois tem bom Atendimento e comida boa, so acho que tem que ter mais promoçoes, quase nao tem , so conheço a do Aniversariante.
475;3 de setembro de 2018;50;MUITO BOM!!!!;Meu Deus do cé! Que lugar sagradooooo!! Algum dia eu vou morar ai e comer carne todo dia nesse trem ai!!! bombombombombombombombom :P
476;3 de setembro de 2018;50;Tudo perfeito!;Tudo perfeito!Muito bom atendimento, fui em família.TemBrinquedos para as crianças.Aproveitamos muito..😍👏👏
477;30 de agosto de 2018;40;CHIMARRON;Ótima churrascaria. Churrasco de primeira. O atendimento pode melhorar, é um pouco desleixado, deixando o cliente na espera.
478;29 de agosto de 2018;50;Melhor churrascaria de Juiz de Fora e Região.;Excelente atendimento, o churrasco é ótimo tudo muito bem feito.Não existe em Juiz de Fora nenhuma churrascaria que se compare ao Chimarron.
479;28 de agosto de 2018;40;Satisfatório;A churrascaria é muito boa, deixa a desejar em alguns pontos. Mas dá região é uma das boas. Uns dos garçons passava em frente a minha mesa e não oferecia nada, isso se repetiu umas três vezes.
480;28 de agosto de 2018;50;laser;atendimento e comida excelente a japonesa então perfeita assim como o camarão que sempre eh maravilhoso, o lugar é tranquilo, nota 9, rsrs
481;28 de agosto de 2018;50;Churrascaria Chimarron;Melhor churrascaria da minha vida!!tudo de primeira qualidade, garçons e garçonetes muito atenciosos. Sem falar nas delícias que são servidas...
482;28 de agosto de 2018;50;O verdadeiro sabor do churrasco.;Uma das melhores churrascarias de Juiz de fora, carne deliciosa, atendimento excelente e preço justo.
483;27 de agosto de 2018;40;Muito bom!;Chegue a partir das 11h para aproveitar os cortes no início do rodízio, assim as carnes estarão mais suculentas e macias.
484;27 de agosto de 2018;50;Lugar perfeito;Desde a recepção dos clientes, ressaltando a comida maravilhosa e terminando com a atenção e rapidez no fechamento da conta, é tudo PERFEITO!
485;27 de agosto de 2018;50;Excelente;Ótimo atendimento, comida de qualidade com bastante opção de carnes e comida japonesa com sobremesas deliciosas.
486;27 de agosto de 2018;50;Lugar otimo para reuniões de trabalho e de família;Churrascaria rodízio com excelente mesa de frios e pratos quentes. Comida japonesa a escolher. Cervejas artesanais e drinks diversos
487;27 de agosto de 2018;40;Ótimo custo beneficio;Otimo atendimento,ótima localização, rodízio de carnes de excelente qualidades, e com comida japonesa também. NOTA 9
488;27 de agosto de 2018;50;O padrão de sempre!;Rodízio muito bom, com carnes especiais, destaque para picanha, costela e leitoa. Para quem gosta de cordeiro, é o lugar certo. Serve também japonês e acompanhamentos deliciosos.
489;27 de agosto de 2018;50;Carne de primeira;Uma comida excelente e um serviço muito bom. Sem falar do ótimo local com muitos pessoas felizes pois quem está la está muito animado para comer uma ótima carne
490;27 de agosto de 2018;50;Melhor churrascaria;Com certeza é a melhor churrascaria de Juiz de Fora, o atendimento é excelente e só serve carnes de qualidade.
491;27 de agosto de 2018;50;Melhor churrascaria da cidade;Excelente atendimento e carnes saborosíssimas. Além de um ambiente muito agradável e ótima localização.
492;27 de agosto de 2018;50;Exelência;Churrascaria e o melhor Japônes da cidade em um mesmo lugar. Espaço Kids com recreadora. E rápido atendimento.
493;25 de agosto de 2018;50;Tudo certo;Dificilmente me decepciono aqui no Chimarron, mais uma vez fui muito bem atendido e degustei excelentes cortes de carne.
494;24 de agosto de 2018;50;Atendimento perfeito carne de primeira qualidade;tivemos um encontro em família.Tudo perfeito, com certeza a melhor churrascaria de JF! Comida excelente e atendimento de primeira.
495;24 de agosto de 2018;50;Qualidade em tudo, comida e atendimento.;Tudo Perfeito!!Atendimento nota 10, garçons sempre atenciosos e generosos, atendimento ótimo, não posso esquecer da minha salada, sempre mantendo sua qualidade.
496;24 de agosto de 2018;50;Delícia de lugar 😍;Lugar maravilhoso onde me sentir muito bem recepcionada. Excelente atendimento e variados cardápio. Resumindo tudo: Este lugar é sem dúvidas sensacional.
497;23 de agosto de 2018;50;Recomendo!;Atendimento excepcional, comida de excelente qualidade, apesar do expediente ser curto durante a semana, por estar acostumado a frequentar nos finais de semana. Mas ainda sim, recomendo com certeza!
498;22 de agosto de 2018;50;Perfeito;Ambiente agradável, melhor seleção das carnes e atendimento impecável. Buffet com muita qualidade nas saladas , sem dúvida a melhor churrascaria que já fui.
499;21 de agosto de 2018;50;recomendo;Excelente atendimento, comida maravilhosa, garçons muito atenciosos e um espaço muito agradável, voltarei com certeza!!
500;20 de agosto de 2018;50;Garantia de qualidade e bom atendimento!;Lugar de qualidade extrema, com carnes perfeitas e, de quebra, uma comida japonesa de primeira. Primeiro lugar em que penso quando quero comer bem.
501;16 de agosto de 2018;50;Excelente;Sempre, uma boa refeição! Um local agradável e equipe atenciosa! Com certeza, irei retornar outras vezes!
502;15 de agosto de 2018;40;Rumo ao melhor;Dou 9, atendimento excelente, comida muito boa, aconchegante, tudo perfeito, mas a nota 9 é para irem atrás do melhor que é o 10, para mim vocês são 1.000 Grato por tudo 😍💘🍗🍖🧀🍟🍝
503;14 de agosto de 2018;50;Excelente;Ótimo atendimento, o buffet e o rodízio são maravilhosos e o serviço é de qualidade. Vale apena conhecer!
504;14 de agosto de 2018;50;Notamil;Pessoa.l nao tenho muito que falar.e simplesmente maravilhoso está neste lugar. Só alegria. Venham e comprove. abraco
505;13 de agosto de 2018;50;EXCELENTE;Atendimento ótimo, com cardápio farto e variado. Excelente custo benefício. Todos os profissionais muito atenciosos, meu esposo esqueceu a carteira e fizeram de tudo para localizá-lo. Tudo espetacular, voltaremos sempre que possível.
506;13 de agosto de 2018;50;Otima experiencia;Uma equipe extremamente simpática e disponíveis, ótimas opções em cortes de carne e uma variedade muita boa de pescados.
507;12 de agosto de 2018;50;Cada vez melhor!;Impressionante! Sou frequentador assíduo da casa há quase 20 anos e durante todo esse tempo a qualidade das carnes e do serviço se aprimora a cada ano! Isso é para poucos, pouquíssimos restaurantes! Parabéns a toda a equipe da Chimarron!
508;12 de agosto de 2018;50;magnifica;vale a pena atendimento de primeira com metres e garçoes educadissimos......esyando sempre presentes e disponobilizando o meihor BUFFET com carnes de primeira qualidade
509;12 de agosto de 2018;50;Sem palavras;Muito top sem palavras ótimo atendimento ambiente muito agradável as comidas muito bem feitas top d mais
510;11 de agosto de 2018;50;Bom serviço;Rodizio muito variado e que oferece opções de comida japonesa. Ambiente agradável e garçons atenciosos. Ótima comida e estacionamento coberto (use o do supermercado).
511;11 de agosto de 2018;50;Chimarron Churrascaria, cada dia melhor.;"Meu Deus, o quê é isto????? Esta Churrascaria te surpreende a cada dia. Atendimento de excelência; jà te recebem com uma suculenta picanha. Chega uma hora que você pede pelo amor de Deus para te tirarem de lá senão você explode de tanto comer. Showwwww."
512;10 de agosto de 2018;50;Delicia;"Ambiente super agradável, garçons educados e prestativos, comida deliciosaaaaaa; vale mto a pena conhecer, variedade de carnes sushis e acompanhamentos, tudo de muita qualidade."
513;9 de agosto de 2018;50;O melhor do gênero na cidade;Está local tem atendimento preservando a excelência. As carnes da melhor qualidade. As bebidas estão com valores muito alto, não justificado em comparação com outros estabelecimento.
514;9 de agosto de 2018;50;Um dos melhores rodízios de carne da Cidade;Atendimento, play para as crianças, carne e comida japonesa muito boas. Preço não é baixo mas o produto é de qualidade então vale muito a pena para quem deseja um excelente rodízio.
515;7 de agosto de 2018;40;Saborosas opções;Bem servido e de boa qualidade com ambiente familiar. Comemoração de aniversário. Todos ficaram satisfeitos. Ainda tem o espaço kids que nossa menina adora
516;7 de agosto de 2018;40;Ambiente confortável;Local confortável, seguro,comida saborosa e ótimo atendimento.Possui uma sala de diversões para crianças.Ideal para encontrar amigos e familiares.
517;7 de agosto de 2018;50;Excelente;Comida de ótima qualidade, atendimento exemplar, localidade perfeita, produtos de primeira linha. Melhor não há.
518;7 de agosto de 2018;40;Bem servido!;Churrascaria conhecida, buffet farto e completo com ótima variedade, bom atendimento, garçons atenciosos, boa localização, preço justo.
519;6 de agosto de 2018;50;Excelente;Parabéns pelo atendimento. Os produtos servidos,de ótima qualidade. Estrutura física aconchegante,ambiente familiar.
520;6 de agosto de 2018;50;A nelhor de Juiz de Fora;Atendimento nota 10. Carnes de qualidade. Um buffet excepcional e ainda tem comida japonesa incluída no rodízio.
521;6 de agosto de 2018;50;Jantar;Excelente atendimento, cardápio variado e ótima qualidade, tudo muito bom, recomendo com toda certeza, aprovadíssimo!!!
522;6 de agosto de 2018;50;Melhor Churrascaria da cidade!;Mesa de frios e saladas bem variada, carnes de primeira, bom atendimento e um Japonês de excelente qualidade! Recomendo...
523;6 de agosto de 2018;50;Atendimento excepcional;Com um ótimo atendimento o local já te ganha na entrada. Com elevador para cadeirantes e total acessibilidade. Comida boa e churrasco melhor ainda. O preço das bebidas deixa um pouco a desejar. Tem ot8ma localização.
524;6 de agosto de 2018;50;Perfeito;Fui comemorar o meu aniversário com meus amigos , e estou muito satisfeita com tudo. Obrigado a todos.
525;6 de agosto de 2018;50;Encatador;Eu indico a churrascaria para os amigos. O restaurante é bem localizado e organizado. Os atendentes são preparados para o atendimento.
526;6 de agosto de 2018;50;Excelente Lugar;Excelente em todos os quesitos! Com certeza é a melhor churrascaria de Juiz de Fora e região! Indico!
527;5 de agosto de 2018;50;Almoço em familia;Reunidos estivemos por ocasião de encontro com amigos , boa comida, diversidade de opções,carnes de diversas origens,temperos diversos,de ótima qualidade.
528;2 de agosto de 2018;50;Carnes de primeira.;Visita em família. Fomos muito bem atendido. Todas a carnes q eu pedi veio a mesa rapidamente. E carnes de qualidade bem superior.
529;1 de agosto de 2018;50;Excelente;Local aconchegante, atendimento eficaz, comida e bebida de primeira. Retornarei sempre que estiver em Juiz de Fora. Recomendo.
530;31 de julho de 2018;50;Maravilhoso;Ambiente maravilhoso, confortável, ótimo atendimento, comida deliciosa, ótima localização. Com certeza vamos voltar.
531;31 de julho de 2018;50;Melhor rodízio da cidade;Atendimento de excelência! Além de alta qualidade no rodízio. Local ideal para comemorações e dias especiais. O preço é um pouco alto, mas vale a pena!
532;30 de julho de 2018;50;Excelente;Equipe excelente e produtos selecionados! A melhor escolha de churrascaria da cidade! O melhor custo beneficio.
