;DATA;RATING;TITULO;REVIEW
266;2 de maio de 2019;50;Dia dos namorados;Bom ambiente, ótimo atendimento, comida maravilhosa! Preço justo. Melhor opção de churrascaria em Juiz de Fora.
267;1 de maio de 2019;50;Restaurante top!!;Ótimo atendimento, muita variedade, recomendaria pra quem quer comida boa e com ótimo atendimento. Excelente!!
268;29 de abril de 2019;50;Melhor Churrascaria de Juiz de Fora;Sempre bem servida, preço justo pelo serviço prestado. Tanto o buffet quanto o rodizio de carne e comida japonesa são muito muito bons.
269;27 de abril de 2019;50;Lugar maravilhoso excelente atendimento;atendimento excelente , o rodizio e bom porem muito repetitivo o suco veio quente na mesa , e a limpeza também deixou desejar .
270;27 de abril de 2019;50;Excelente;Churrascaria Caria muito boa, não vi defeitos. Atendimento de primeira, comida excelente, serviço impecável.
271;25 de abril de 2019;50;Excelente;Ótima localização , com estacionamento, espaço Kids muito importante para quem vai com criança, cardápio maravilhoso e carnes saborosas
272;24 de abril de 2019;50;Bem estar;É sempre maravilhoso estar na chimarron, lugar sempre aconchegante, ótimo atendimento e a comida mais saborosa da cidade... Obrigado sempre pelo atendimento...
273;22 de abril de 2019;40;Aniversário;Eu recomendaria sem nenhum problema! bom atendimento, profissionais de ótima qualidade, e um serviço top, só achei um pouco caro, a nível de juiz de fora!
274;16 de abril de 2019;50;Igor Silva Jr;Lugar agradável Ótimo atendimento Super recomendo Para ir com os amigos ou em trabalho Ou com a namorada
275;15 de abril de 2019;50;Excelente lugar para se comemorar seu aniversário;Muita variedade de saladas, japonês, além das comidas quentes e carnes claro. Cardápio para todos os gostos permitindo assim maior entrosamento e satisfação dos clientes.
276;15 de abril de 2019;50;Excelente;Acho muito bacana o desconto para nós, bariátricos! Já é bom, com o desconto, fica melhor ainda!!! Não obstante a enorme variedade de carnes, há opções de saladas, peixes e frutos do mar, além da deliciosa culinária japonesa!
277;14 de abril de 2019;50;CHIMARRON SEMPRE TUDO DE BOM.Excelente atendimento,Buffet de variedades,Comida ir;Excelente atendimento,Buffet bem variado,Japas Maravilhosos.Ambiente confortável e Familiar. O que falar mais da Chimarron?Para mim sinônimo de Perfeição. Por isso que minha frase ao mencionar este estabelecimento é:CHIMARRON TUDO DE BOM.
278;14 de abril de 2019;50;A melhor opção de Juiz de Fora;A cada visita a esta casa, uma experiência surpreendente, cortes diferenciados, atendimento nota 10, do início ao fim. Parabéns pelo excelente serviço!
279;14 de abril de 2019;50;Excelente opção;Carnes boas e diversas. Ambiente agradável e bem localizado. Difícil parar de comer. Muito recomendado
280;13 de abril de 2019;50;Excelente atendimento e variedade;A Chimarron sempre tem muita variedade, uma comida muito boa e o atendimento excelente. Os valores são altos, mas vale a experiência.
281;13 de abril de 2019;50;Carnes especiais;Sempre são servidas carnes de excelente qualidade. Churrascaria clássica na cidade. Saladas selecionadas. Além de comida japonesa e vários acompanhamentos deliciosos.
282;13 de abril de 2019;40;Comida farta;Excelente, porém peca pela ausência de variedade. Local agradável contudo sem uma vista atraente. Voltaria lá
283;13 de abril de 2019;50;Churrascaria da melhor qualidade.;Excelente churrascaria, com carnes de primeira qualidade, atendimento muito bom, chopp e cerveja gelados e ainda servem comida japonesa. Recomendo.
284;10 de abril de 2019;50;excelente;comida japonesa excelente, funcionários simpáticos e agradáveis. Carnes selecionadas. super indico!!
285;9 de abril de 2019;50;Ótimo;Serviço excelente, carnes, frios, japonês, ar condicionado, banheiros, vale muito a pena! Recomendo!
286;4 de abril de 2019;50;EXCELENTE!;Atendimento e qualidade de excelência. As carnes são boas e fartas. Muito bom. Dá show em muitas churrascarias de capital.
287;26 de março de 2019;50;Melhor churrascaria de JF e região;Atendimento de qualidade. Opções de alimentação excelentes. Também conta com comida japonesa em seu cardápio. Ambiente agradável.
288;25 de março de 2019;50;Excelente;Excelente comida e ambiente muito agradável. Garçons muito solícitos. O único inconveniente é que precisei me levantar para passar o cartão.
289;24 de março de 2019;50;Excelente;Churrascaria muito boa com padrão de capital e com o preço acessível. O atendimento é atencioso e os mapas são deliciosos
290;23 de março de 2019;50;Simplesmente Espetacular.;Serviço muito bom. Garçons educados. Alimentação de primeira linha. Não tenho nada a reclamar. Indico sempre.
291;22 de março de 2019;40;Chimarron a Churrascaria da preferência de minha família;avalio como bom atendimento! ótimo atendimento! recomendo aos amigos! já estive na chimarron em outra oportunidade, por isso, retornei.
292;20 de março de 2019;40;Uma tarde muito agradável;Nossa chegada foi ótima. Já na portaria nos deparamos com funcionários atenciosos e educados. Ambiente climatizado, estava tudo muito saboroso e pratos variados. Como sempre é um grande prazer pra mim , ir a Juiz De Fora e almoçar no Chimarron Churrascaria.
293;20 de março de 2019;50;Excelente atendimento;Um excelente atendimento um ambiente muito bom para ir com família e amigos garçons super atenciosos e educados e carnes de ótima qualidade!
294;20 de março de 2019;50;VIP;Atendimento vip. Area de lazer para as crianças, com monitora presente para tranquilidade da familia. Melhor churrascaria de Juiz de Fora
295;20 de março de 2019;50;Melhor churrascaria da cidade;Superando a potência em qualidade, tanto das carnes quanto do atendimento. Melhor churrascaria da cidade, ambiente excelente para almoçar e jantar.
296;19 de março de 2019;50;excelente churrasco;excelente atendimento,garçons muito atenciosos ,quanto ao churrasco nao tem o que falar,bem temperado,excelentes carnes,tudo de primeira
297;19 de março de 2019;50;Excelente!;Muito bom ir a um restaurante com excelente atendimento e comida maravilhosa. Ótimo lugar para encontrar os amigos. Recomendo.
298;19 de março de 2019;50;Muito top!;Esse merece a visita, tudo de primeira, muita variedade e qualidade, uma ótima sessão de comida japonesa, frios e, lógico carnes para todos os gostos.
299;18 de março de 2019;50;Ótimoo!!!;Melhor local para reunir família e amigos, ambiente agradável, ótima recepção. Super recomendo e voltarei mais vezes.
300;13 de março de 2019;50;Tudo ótimo!;Felizmente a cada vez que vou na Chimarron a qualidade, variedade e serviço só melhoram. Parabéns à equipe.
301;11 de março de 2019;40;Boa experiência;Atendimento excelente. Variedade razoável de carnes podendo melhorar um pouco nesse quesito. Comida japonesa muito boa.
302;10 de março de 2019;50;agora tem o melhor risoto da cidade;nao deixe de pedir nas guarnicoes o risoto de camarao , voltaria somente por ele de tao gostoso, tive boa surpresa ao perceber que agora tem novidades no rodizio como o risoto e queijo empanado
303;7 de março de 2019;40;Gostei;Poderia ter mais opções de carnes bovinas exemplo: picanha Argentina, carré de cordeiro, carne de caça.
304;7 de março de 2019;50;Melhor da região!;Comida de 1ª & atendentes super educados... Lugar limpo, super indico a todos do TRIPADVISOR. Pensou em JF, pensou em CHIMARRON
305;7 de março de 2019;50;Satisfeito;Gostei muito do atendimento. Fiquei surpreso por ver que a Chimarron reduziu os preços das bebidas e sobremesas. Já estava na hora de fazer isso, pois o valor anterior era abusivo. Parabéns pela iniciativa.
306;5 de março de 2019;50;Melhor atendimento!;Melhor atendimento! De todos os estabelecimentos que já tive a oportunidade de visitar eles são o melhor atendimento. Comida maravilhosa somente produtos de qualidade.
307;28 de fevereiro de 2019;50;Variedade de carnes e agilidade no atendimento;A chimarron possuo grande variedade de carnes, as quais o tempo todo os garçons passam oferecendo. Também possuo mesa de frios e pedidos de japonês. Ótimos rodízio de carnes.
308;27 de fevereiro de 2019;50;A melhor churrascaria de Juiz de Fora!;Atendimento excelente! Área kids! Ambiente super agradável! Tudo perfeito para saborear aquele churrasco especial!
309;27 de fevereiro de 2019;50;Atendimento excelente...;"Atendimento excelente... Comida boa demais... Ambiente super agradável... Tudo de bom... E com certeza eu recomendo para todos... ;-)"
310;26 de fevereiro de 2019;50;Rodízio super recomendado;Qualidade e atendimento top. Carnes super variadas e servidas no ponto certo. Equipe super atenciosa. Vou sempre que posso com minha família.
311;26 de fevereiro de 2019;50;Super recomendo;Atendimento excelente, garçons super atenciosos, ambiente maravilhoso e aconchegante. Eu super recomendo este estabelecimento!
312;24 de fevereiro de 2019;40;Ótimo rodízio;Qualidade do buffet, atendimento, carnes, japonês, tudo ótimo! Um casal tomando uma água e um refrigerante vai gerar uma conta de pouco menos de 200 reais.. acho que vale muito!!
313;24 de fevereiro de 2019;50;Churracaria referencia na cidade;Muito boa! Carnes de qualidade, variedade fantastica. Mesa de frios otima! Espaco kids! Agrada a todos os gostos! Melhor churrascaria de rodizio de juiz de fora
314;22 de fevereiro de 2019;50;Atendimento excelente, só faltou camarão GG;Carne de primeira, funcionários excelentes no tendimento, preço poderia melhorar...rsrs Sugiro mais promoções!!
315;20 de fevereiro de 2019;50;Espetácular;Atendimento nota mil... Peixes grelhados um espetáculo, casquinha de salmão com alho poró, magnífico!!! Camarão estava sem tempero. A parte do buffet uma delícia!! Amei!! Parabéns a equipe.
316;19 de fevereiro de 2019;50;EXCELENTE ATENDIMENTO!;É a melhor churrascaria de Juiz de Fora e Região! Atendimento primoroso! Comida espetacular! RECOMENDADÍSSIMO O LOCAL!!!
317;18 de fevereiro de 2019;50;😊😊;Atendimento sempre excelente. Comida de primeira e lugar super agradável. Sempre ficamos satisfeitos.
318;15 de fevereiro de 2019;40;Jantar agradável;Já fui a vários restaurantes a convite de laboratórios médicos. Na Chimarron o espaço é agradável, o serviço de primeira e a comida deliciosa!
319;15 de fevereiro de 2019;50;top;muito bom, tudo de otima qualidade,principalmente o bom atendimento recomendo .. e varias vezes eu vou com amigos e familiares....
320;14 de fevereiro de 2019;40;Boa churrascaria;Otima carne e bom atendimento. Boa diversidade de carnes e de buffet. O local é que é ruim com acesso por escada
321;14 de fevereiro de 2019;50;O melhor churrasco da cidade.;Boa localização, atendimento cordial, cozinha variada de ótima qualidade.Não existe problema de estacionamento pois utiliza o do supermercado anexo. Talvez possa melhora a acústica pois salão é grande e acomoda muitas pessoas.
322;14 de fevereiro de 2019;50;Excelente;Ótimo atendimento, equipe prestativa e atenciosa, comida deliciosa. Fácil estacionamento. Recomendo.
323;13 de fevereiro de 2019;50;Ótimo;Como sempre sou muito bem recebida e servida no restaurante... Super recomendo e em breve volto pra mais um almoço ou jantar
324;13 de fevereiro de 2019;40;Melhor Churrascaria da região;Melhor Churrascaria da região, precisando apenas (na minha opinião) de um estacionamento próprio para atender a demanda.
325;13 de fevereiro de 2019;50;Excelente melhor impossível quero ir de novo meu filho de seis anos todo dia pergunta que dia que vos novamente;Muito bom se pudéssemos iríamos toda semana ou de 15 em 15 dias mas infelizmente não podemos, assim que der vamos novamente eu toda a minha família......
326;13 de fevereiro de 2019;50;excelente;tudo de bom meus filhos adoram o ambiente voltaria novamente , excelente atendimento dos grcons muito bem servida !!!
327;12 de fevereiro de 2019;50;Churrascaria Chimarrão;Excelente churrascaria, carnes de primeira, mesa de frios muito farta, cozinha japonesa, atendimento cordial, ambiente climatizado e público selecionado.
328;12 de fevereiro de 2019;50;Valeu a experiência;Ótimo lugar! Atendimento de ponta e ambiente agradável. Tudo que é servido é uma delícia, o único problema é o preço altíssimo.
329;12 de fevereiro de 2019;50;Boa churrascaria;Sistema de rodízio de carnes com bons cortes. Buffet de salada, camarão, bacalhau, casquinha de salmão muito boa. Excelente custo benefício
330;11 de fevereiro de 2019;50;Ótimo, Recomendo!;Há uma grande variedade de carnes e pratos. Atende a todos os gostos.Tem um bom parquinho com monitores. Os funcionários são muito atenciosos.Poderia ter opções de sobremesa. É o que falta pra ser nota mil.
331;10 de fevereiro de 2019;50;excelente;ótimo atendimento e um serviço de primeira qualidade, além de que todas as demandas apresentadas são atendidas...
332;7 de fevereiro de 2019;50;Excelente qualidade no atendimento;Excelente qualidade no atendimento e garçons não deixa o prato ficar vazio... sempre nos atende, sempre com respeito dialogando sobre as carnes...e
333;6 de fevereiro de 2019;40;Comer bem;Montar uma outra estrutura para atender seus clientes, pois o ambiente estava cheio e bastante barulhento, mas a comida estava boa.
334;5 de fevereiro de 2019;50;Excelente;Gostaria de parabenizar a todos em especial o metre Neto e a educadora Cris. No mais, todos estão de parabéns, ambiente muito agradável.
335;5 de fevereiro de 2019;50;Muito bom atendimento, comida boa e muitas opções.;Tudo muito bom, espaço bom, comida excelente, garçons educados, muita variedades de comida, e a casquinha de siri então... uma delicia.
336;5 de fevereiro de 2019;50;Ótimo serviço.;Qualidade de atendimento e preocupação dos funcionários em melhor atender o cliente é um grande diferencial, não se esquecendo da qualidade e diversidade de das comidas e bebidas
337;23 de janeiro de 2019;50;SEMPRE ÓTIMO;A chimarrom é, sem dúvida, a melhor churrascaria que conheço. E posso compará-la com churrascarias de Belo Horizonte, Rio, etc. Sempre nos surpreende com novidades, novos cortes de carne, e a mesa de frios sempre impecável.
338;18 de janeiro de 2019;50;Excelente atendimento;O Chimarron Churrascaria é um excelente restaurante, com variáveis cardápios e de ótima qualidade. Seus funcionários são cordiais, prestativos e querem sempre mostrar um excelente serviço para com os clientes.
339;16 de janeiro de 2019;50;excelente;Comida deliciosa como sempre, atendimento impecavel. O aniversariante ainda teve o jantar pago pela casa como cortesia. recomendo
340;16 de janeiro de 2019;50;Formidável!;Churrascaria de alto padrão e sem dúvidas a melhor de Juiz de Fora e região. Buffet marvailhos, ambiente excelente, atendimento exemplar. RECOMENDO!!!
341;16 de janeiro de 2019;50;Culinaria;Melhor churrascaria rodizio de Juiz de Fora, carnes de primeira qualidade. Tem comida japonesa inclusa, buffet de frios e acompanhamentos
342;16 de janeiro de 2019;50;Adoro, muito bom.;Churrascaria bem localizada, de fácil acesso com um ambiente agradável e uma grande variedade de comidas.
343;16 de janeiro de 2019;50;Lugar de ótimos momentos;Fomos muito bem recebidos, estávamos com um bebê, nos foi oferecido uma mesa em um bom lugar, todos lá são muito atenciosos. Indico para todos os tipos de ocasiões. Sempre voltaremos lá.
344;15 de janeiro de 2019;40;Qualidade no atendimento e alimentação;O chimarron possui uma grande variedade de carnes e preparações para satisfazer a necessidade do cliente. Tem um bom atendimento e comida de qualidade. Ambiente um pouco barulhento como na grande maioria das churrascarias.
345;15 de janeiro de 2019;50;Excelente;Excelente local para encontrar e passar bons momentos com amigos ou família. Ótimo serviço e qualidade de carnes servidas a todo momento.
346;15 de janeiro de 2019;50;A melhor de JF;Grande variedade de carros, monitora infantil atenciosa, garçons muito solícitos. Comida japonesa ótima!!!!
347;15 de janeiro de 2019;50;Domingo Delícia;Os domingos na Chimarron Churrascaria são uma delícia. Além da comida deliciosa e muito saborosa, o atendimento dos garçons é sempre muito bom e o ambiente da casa é muito agradável.
348;15 de janeiro de 2019;50;Serviço de qualidade;Carnes suculentas, buffet de qualidade, uma casquinha de siri das melhores, garçons simpáticos, super indico!!
349;15 de janeiro de 2019;50;Excelente!;Melhor opção para comer carne e japonês de qualidade! Custo benefício excelente! Volto sempre que posso.
350;14 de janeiro de 2019;50;Perfeito;O atendimento é perfeito, as carnes e os acompanhamentos são deliciosos, a área kids ajuda muito os pais e avós poderem aproveitar com tranquilidade e os sucos sao muito saborosos. Realmente vale a pena conferir.
351;14 de janeiro de 2019;50;Excelente;Muito bom atendimento, boa comida, bom churrasco ótima sobremesa, além de ser situada próximo ao centro da cidade.
352;11 de janeiro de 2019;50;A melhor de Juiz de Fora;Ótima pedida para quem aprecia um excelente churrasco! Carnes nobres, buffet de saladas diversificado, comida japonesa e pratos quentes deliciosos! Tudo isto em um ambiente confortável, climatizado e atendimento impecável! Parabéns!
353;10 de janeiro de 2019;50;Excelente;Ótima churrascaria,atendimento diferenciado e carnes de alta qualidade.Sempre que posso e passo em JF almoço lá.Estão de Parabéns!!
354;8 de janeiro de 2019;50;Top;Excelente atendimento e o rodizio e espetacular. A comida japonesa esta sempre fresca e muito bem feita.
355;7 de janeiro de 2019;50;Aniversário;Excelente churrascaria , uma das melhores de Juiz de Fora buffet de frios , japonês perfeito! Muito bem localizado, estacionamento, instalações muito boas e ótimo atendimento!
356;7 de janeiro de 2019;50;Tudo de bom!!!;Atendimento excelente, comida incrível e lazer com segurança e qualidade para as crianças, são os diferenciais. O melhor de Juiz de Fora.
357;6 de janeiro de 2019;50;Excelente!;"Ambiente familiar; comida e atendimento excelente! Recomendo para almoço ou jantar... Sempre tenho marcantes experiências na Chimarron!"
358;1 de janeiro de 2019;20;Custo benefício ruim;Demora para servir, só passa carne mal passada, se quiser em outro ponto tem que implorar. Servem petiscos sem ser solicitado o que gera desperdício.
359;29 de dezembro de 2018;40;Ótimo;Excelente ambiente. Serviço muito bem prestado. Apresenta grande variedade de carnes, petiscos e uma deliciosa seção de sushi. Super recomendável.
360;28 de dezembro de 2018;40;Bom custo-benefício;"Carnes gostosas, diversificadas, tem japonês e buffet incluídos no rodízio. Paguei 80reais. Os funcionários eram muito educados e cordiais. Fica em um ""shopping"", tem estacionamento no local, inclusive o restaurante da uma vale para o estacionamento de 2h."
361;27 de dezembro de 2018;50;Melhor churrascaria;Gente nem tenho o palavras! Tudo q servem lá é maravilhoso carnes, Japa, antepastos etc Se não conhece vale a pena! Excelente!!!
362;27 de dezembro de 2018;20;reclamaçao;Bom dia gostei muito do Atendimento,Mais o que me foi cobrado fora da realidade,tenho frequentado vários lugares também com o mesmo nível de voces e com preço bem melhor
363;26 de dezembro de 2018;40;Ambiente muito tranquilo;Churrascaria excelente ,o atendimento muito bom gostamos muito do local com certeza iremos voltar e comer aquela picanha bem saborosa
364;26 de dezembro de 2018;50;Excelente!;Bom atendimento pelos garçons e gerentes e muita variedade de pratos e carnes. Temperos e pratos frios nota 10.
365;26 de dezembro de 2018;50;chimarron tudo de bom;Muito bem atendida ,carnes com bom tempero,suco delicioso,muita atenção.Obrigada pelo atendimento e atenção.
366;25 de dezembro de 2018;50;Tudo maravilhoso!!!;Adorei o atendimento...carne e outros alimentos de primeira qualidade... Nota 10....Parabéns...em breve estarei aí
367;24 de dezembro de 2018;50;Excelente;Atendimento excelente. Espaço e ambientes maravilhosos. Quadro funcional de alto nível. Atenção aos clientes muito boa.
368;21 de dezembro de 2018;50;Excelente churrascaria;Excelente churrascaria, boa variedade de carnes, acompanhamentos e atendimento 10. Uma boa pedida para comemorar o aniversário, o aniversariante é cortesia.
369;21 de dezembro de 2018;50;Excelente churrascaria.;Atendimento nota dez, buffet, carnes deliciosos, ambiente aconchegante. Não podendo esquecer do arroz piamontese.
370;21 de dezembro de 2018;50;Excelente!;Lugar muito bacana para ir, seja com amigos, familiares ou negócios!Atendimento muito bom e a comida maravilhosa!
371;20 de dezembro de 2018;50;Melhor churrascaria, melhor atendimento, melhor ambiente...melhor em tudo!;Lugar muito bom, não tem orientações que dar, fomos muito bem acomodadas, e muito bem recebida, da entrada a saída!Só acho que teria que ter mais promoções!
372;18 de dezembro de 2018;50;MUITO BOM;lá a o ambiente é ótimo, o atendimento é excelente e a comida é maravilhosa, sem contar o atendimento que é sempre de primeira.
373;18 de dezembro de 2018;50;CARNAVALI;Atendimento impecável de gerentes e atendentes, carnes muito bem preparadas e comida japonesa ótima e muito fresca.Tudo perfeito
374;17 de dezembro de 2018;50;Melhor rodízio da cidade;Como sempre a visita a Chimarron foi maravilhosa, atendimento impecável e o rodízio de carnes, japonês e o bufett estavam uma delícia.
375;16 de dezembro de 2018;50;Uma das melhores churrascarias de Juiz de Fora!;Atendimento impecável, cardápio bem elaborado em um ambiente elegante e climatizado. Parabéns à gerência e à todos os funcionários!
376;16 de dezembro de 2018;50;simpatia;excelente atendimento , garçons muito educados e lugares bem confortáveis o ambiente muito agradável.
377;15 de dezembro de 2018;50;Perfect;Ambiente impecável, qualidade no atendimento e as melhores carnes . comparável com as melhores churrascarias de São Paulo e Rio de Janeiro .
378;15 de dezembro de 2018;50;Excelente;Fui com meus filhos e gostei muito. Nem comi muita carne, pois o japonês era tão bom q não teve espaço. Atendimento excelente . Saladas ótimas tb.
379;14 de dezembro de 2018;50;Muito bom, pretendo ir mais vezes.;Excelente churrascaria a melhor de Juiz De Fora. Pretendo ir mais vezes... Gostei muito tbm do atendimento.
380;13 de dezembro de 2018;50;Chimarron;Comida muito boa e para todos os gostos, com muita variedade de pratos. O atendimento também é muito bom.
381;13 de dezembro de 2018;50;Excelente;Atendimento perfeito, variedade de pratos, tanto carnes, como saladas e peixes. Ambiente agradável. Tudo de bom.
382;13 de dezembro de 2018;50;Qualidade acima de tudo;Lugar de reunir a família, os amigos, a empresa, etc... Atendimento de primeira qualidade. Conforto e boa comida.
383;12 de dezembro de 2018;50;Melhor churrascaria da cidade;É a melhor churrascaria da cidade, lugar perfeito para um almoço de domingo. Carnes especiais e uma variedade muito grade de frios.
384;11 de dezembro de 2018;50;Tudo de bom;Do atendimento ao churrasco, excepcional. Lugar agradável, atendimento ímpar, comida excelente, espaço para crianças. Nenhuma reclamação ou crítica.
385;11 de dezembro de 2018;40;Mestre churrascaria fraco.;Local continua bom, já foi melhor. Pedi um chorizo e o mestre churrasqueiro não sobe mandar a carne certa. Mas no geral a casa continua boa.
386;11 de dezembro de 2018;50;Adorei;Apesar de estar uma fila enorme, fomos agraciados com uns pasteizinhos deliciosos de cortesia e quando fomos realmente jantar, fomos muito bem servidos, mesmo a churrascaria estando lotada. Não faltou a reposição de nada e estava tudo muito gostoso!!!!!
387;11 de dezembro de 2018;40;Atendimento rápido;As porções são pequenas considerando o valor, mas o sabor os temperos são bons. Bebida sempre gelada!
388;11 de dezembro de 2018;50;Foi tudo perfeito.;Sempre recomenda, tudo perfeito o atendimento à variedades de coisas principalmente pra mim q não como carne, encontro várias opções. Super recomendo.
389;10 de dezembro de 2018;50;Nunca Esqueceremos;Tudo ótimo e perfeito! Único inconveniente é esperar na fila para entrar. Se tiver com muita fome ou sem paciência pode demorar...
390;10 de dezembro de 2018;50;Prazeroso;Local que sempre sou bem atendido, ambiente familiar e agradável a carne sem comentários... maravilha
391;9 de dezembro de 2018;50;Delícia de rodízio;"Não chegamos no melhor horário para um rodízio; eram 16h45 e o horário de encerramento é às 18h, mas foi ótimo mesmo assim. Tudo o que comi estava maravilhoso! Todas as carnes e os acompanhamentos impecáveis! Especialmente, a costela premium! Recomendo!"
392;9 de dezembro de 2018;50;Top;Excelente churrascaria, qualidade e variedade sem explicação, fácil localização, atendimento de primeira.
393;9 de dezembro de 2018;50;Bom reunir com amigos...;A churrascaria tem um atendimento excelente, ideal para reunir com amigos família pessoas de trabalho reunião de negócios e muito mais
394;9 de dezembro de 2018;50;Um ótimo lugar;Um ambiente familiar com a comida boa e de qualidade...atendimento excelente tudo de primeira...obrigada
395;9 de dezembro de 2018;40;Bebidas caras;Bebidas muito caras, fora da realidade. A margem de lucratividade está acima dos 200%, um absurdo! As comidas são dentro da expectativa.
396;27 de novembro de 2018;50;Tudo muito bom.;Carnes e demais degustações muito deliciosos, ótimo atendimento, desde a recepção, garçons até a gerência. Tudo ótimo!
397;26 de novembro de 2018;50;Esplândido!!!;Pessoal atencioso, comida saborosa e diversa. Vou sempre que estou em JF.Cliente fiel. Em dezembro iremos novamente.
398;26 de novembro de 2018;50;Muito bom!;Atendimento exemplar. Bem servido, comida muito boa, carne muito gostosa. Ambiente aconchegante. Excelente!
