;DATA;RATING;TITULO;REVIEW
533;29 de julho de 2018;50;Melhor serviço e qualidade de Ótimo.;A Chimarron tem seu diferencial pela qualidade do serviço nos seu detalhe!!! Exelente atendimento e qualidade gastronômica!!
534;29 de julho de 2018;50;Atendimento;Atendimento excelente, diversas opções. Os garçons sempre se preocupando e perguntando se tínhamos alguma preferência. Excelente
535;27 de julho de 2018;40;Uma boa churrascaria!;Uma boa churrascaria para quem quer carne. Se você deseja sushi ou guarnições, vá a uma casa de comida japonesa ou a um restaurante de comida a quilo. Churrascaria é para comer carne e a Chimarron cumpre esse papel muito bem.
536;26 de julho de 2018;50;Melhor opção de churrasco em JDF;Melhor opção de churrasco em Juiz de Fora, preço justo pela variedade de frios, comida japonesa e carnes. Excelente atendimento.
537;24 de julho de 2018;50;Excelente;Ótimo atendimento, equipe educada, lugar aconchegante e limpo. Comida ótima,deliciosa. Estão de parabéns.
538;24 de julho de 2018;50;Otima noite;Otimo estabelecimento! Atendimento fantástico! Comida excelente! Funcionários muito educados e preocupados em atender bem!
539;23 de julho de 2018;50;Muito bom o lugar;Bem, sem palavras o lugar... Lugar bem familiar, carnes bem deliciosa, tudo maravilhoso. Moraria tranquilo em Juiz de fora.
540;21 de julho de 2018;50;Maravilhoso;Super satisfeita com o atendimento e a variedade do buffet. Voltarei com certeza! Preço razoável porém fui no dia de semana e o preço foi satisfatório. Recomendo!
541;18 de julho de 2018;50;Maravilhoso!!!!;Comida, atendimento, ambiente, tudo perfeito!!!! Carnes no ponto, comida japonesa deliciosa é um atendimento nota 10 de toda equipe ! Parabéns!!!! Supera as expectativas sempre!
542;17 de julho de 2018;50;Otimo local;Lindo local, com um perfeito atendimento. Recomendo a visita sempre que possível. Com amigos ou para negócios.
543;16 de julho de 2018;50;Excelente;Otimos cortes, garçons qualificados, ótimos queijos e frutos do mar, e sobre a parte kids, ótima funcionária, cuidou mto bem da minha filhinha ... venham pra SP por favor
544;16 de julho de 2018;50;Top;Excelente local para passar a tarde, comida deliciosa e atendimento de excelente qualidade! Além disso, a localização é boa, fácil chegada e saída! Ahhh, a comida japonesa é deliciosa! Parabéns
545;15 de julho de 2018;40;Ótima churrascaria;Mesmo sendo dispendioso, comer lá é bom. Carnes variadas (recomendo alcatra e costela). Atendimento rápido e eficiente.
546;13 de julho de 2018;50;EXCELENTE;Tudo ótimo, atendimento nota mil, vale muito a pena ir na Chimarron Churrascaria. Preços acessíveis e qualidade em todos quesitos.
547;12 de julho de 2018;50;Excelente;Pequeno período de espera,comida ótima,atendimento agradável , local limpo e organizado, atenção às solicitações ,sugestões pertinentes.
548;11 de julho de 2018;50;Fim de Semana;Uma das melhores churrascaria de nossa cidade. Ótimo atendimento, fácil estacionamento, rodízio top e um Japonês maravilhoso.
549;9 de julho de 2018;50;Excelente;Gosto muito da Chimarron. Carnes muito boas, garçons agradáveis. Um ótimo ambiente para curtir com amigos e família.
550;9 de julho de 2018;50;Encontro inigualável;Como sempre, uma experiência gastronômica sem igual. Não só o serviço, como também o ambiente aconchegante que propicia um encontro familiar inigualável.
551;9 de julho de 2018;50;Comemorando aniversário;Excelente serviço , atendimento e degustação. Atendimento rápido e com qualidade ao cliente. Serviço especial para o acesso de idosos com dificuldades para subir escada.
552;9 de julho de 2018;50;Maravilhoso;Eu amei, simplesmente maravilhoso. O atendimento as comidas tudo mt bom e de ótima qualidade. Parabéns
553;9 de julho de 2018;50;Excelente;Tudo preparado com a maior organização, desde a sua entrada, serviço de primeira, carnes variadas e também comida japonesa, serviço top e muita qualidade no atendimento, comidas e carnes servidas.
554;9 de julho de 2018;50;Sempre uma excelente experiência!;Eu sou muito suspeito para avaliar a casa. A minha relação com a chimarron, já tem mais de 10 anos. Neste tempo todo, não há um momento em que possa dizer, que me decepcionei com o que quer que seja.
555;9 de julho de 2018;40;Muito bom;Melhor churrascaria de Juiz de Fora. As carnes são excelentes e o atendimento é de primeira linha...
556;8 de julho de 2018;50;Muito boa!;Churrascaria bacana, bom atendimento, garçons educados e com variedade de carnes. Excelente opção para rodízio.
557;7 de julho de 2018;50;Excelente;Estrutura, atendimento e qualidade! Ótimo pata família, principalmente com crianças pequenas. Farta opção de carnes e sucos naturais.
558;4 de julho de 2018;50;Adorei;Adoramos o atendimento , comida maravilhosa bebidas geladas buffet perfeito, os garçons super simpáticos ,metre e gerente super atenciosos, super indico.
559;4 de julho de 2018;50;Local muita agradável, recomendo!!;Local muito agradável, atendimento excelente, tudo de ótima qualidade!! Amei pretendo voltar sempre.
560;3 de julho de 2018;50;Bom atendimento;A comida é simplesmente maravilhosa desnecessita comentários, nota 10. O atendimento é muito rápido e eficaz, tem sempre um rapaz que vai checar se ta tudo ok se precisam de algo etc e o clima do ambiente é muito bom, ótimo lugar para família
561;2 de julho de 2018;50;Adorei....top demais!;Atendimento excelente! Carnes maravilhosas.....preco bom! E ambiente ótimo! Indico a todos a churrascaria!
562;1 de julho de 2018;40;Excelente;Comida realmente muito boa, carne de primeira qualidade. Os serviços são muitos bons, com um bom atendimento por parte dos funcionário.
563;1 de julho de 2018;50;Muito bom!;Lugar agradável, com muita diversidade de carnes e outras opções no cardápio!! A opção de sobremesa também agrada bastante! O atendimento é diferenciado!!!
564;30 de junho de 2018;50;Tudo perfeito;Comida maravilhosa, atendimento perfeito , super atenciosos , espaço kids, fiquei super tranquilha aproveitando meu jantar.
565;28 de junho de 2018;50;Local agradável para ir com a família!!;Não deixem de comer a tilápia com amêndoas e a casquinha de siri. Você também pode pedir uma barca com comida japonesa e se quiser saborear uma carne a alcatra com queijo é uma delícia!
566;26 de junho de 2018;50;Melhor churrascaria de Juiz de Fora;Melhor atendimento e melhor oferta de carnes. Definitivamente, a melhor churrascaria de Juiz de Fora!
567;25 de junho de 2018;50;Coma com prazer sem se enganar.;Excelente atendimento de qualidade e atencioso, ambiente familiar e climatizado, vale cada centavo ..
568;25 de junho de 2018;40;Muito bom;Foi tudo muito bem. Só achamos que no mes de aniverario deveria durar a promoção para o mes todo, não só na semana.
569;24 de junho de 2018;30;Podia ter sido melhor!;Foi bom, porem chegamos tarde, aí não vieram variadades de carne e não serviram muito, parecia que queriam acabar logo.
570;24 de junho de 2018;50;Sempre excelente;Sempre excelente!!! Carne muito boa, comida japonesa muito boa, atendimento muito bom !!! Sempre vale a pena ir ...
571;24 de junho de 2018;50;Ótimo local;Atendimento nota 10. Tudo muito bom. Recomendo com louvor! Ambiente muito agradável. Espaço kids muito legal.
572;23 de junho de 2018;40;Muito Bom;Muito boa churrascaria, bom atendimento, carnes, frios e japa de ótima qualidade e sabor e preço justo pelo que é oferecido.
573;21 de junho de 2018;50;Excepcional!!!!;Fui em uma segunda feira, 12/06 e foi simplesmente maravilhoso. Super recomendo, comida boa, o japa ótimo e carne... um espetáculo a parte!
574;19 de junho de 2018;50;EXCELENTE!;Sempre que tenho uma data especial para comemorar, procuro a Chimarron. Ela é ótima em tudo!!! Parabéns!
575;19 de junho de 2018;50;Almoço;Magnífico a melhor. Conta com um parque com excelentes cuidadoras. O rodízio é farto e tem bastante opções. Com o atendimento diferenciado.
576;19 de junho de 2018;50;Excelente;Carnes macias, bem feitas, sobremesas maravilhosas. Atendentes de garçons super atenciosos. Brinquedoteca com muitas variedades para crianças.
577;18 de junho de 2018;30;Bom restaurante;É uma boa churrascaria...para quem gosta dessa proposta, a comida é boa, o atendimento é muito bom, mas acho que o ambiente poderia ser melhor.
578;18 de junho de 2018;50;Muito bom!;A churrascaria é muito boa... tudo muito bom e saboroso. O japonês é maravilhoso também!!! Ambiente agradável.
579;18 de junho de 2018;40;Churrasco sempre vai bem;Ótimo atendimento e qualidade de ambiente , mesa de frios e opções de carnes . Cupim, picanha nobre e os acompanhamentos estão entre os pontos altos.
580;18 de junho de 2018;50;Aniversário;Excelente atendimento: recepção, garçons, gerência . Gastronomia maravilhosa, com qualidade. Super recomendo.
581;18 de junho de 2018;50;Melhor Churrascaria de JF;Sem dúvida, melhor churrascaria de Juiz de Fora! Além disso, tem uma comida japonesa maravilhosa! Atendimento muito bom! Não é barato, mas vale a pena!
582;18 de junho de 2018;50;Melhor Churrascaria.;Ótimo ambiente, atendimento nota 10 , muito farto, carnes de ótima qualidade, além de servir comida japonesa muito saborosa. Recomendadíssimo!👍
583;16 de junho de 2018;50;Chimarron;Tudo que precisava pra comemorar o dia do namorados nao poderia ser o melhor Lugar pra ter cido escolhido. Lugar excelente com atendimento de qualidade e com o melhor rodizio de juiz de fora.
584;16 de junho de 2018;50;Exvelente;Fomos muito bem servidos ,ambiente familiar e minha namorada está grávida tivemos uma ótima recepção.
585;15 de junho de 2018;50;Nota 10! Atendimento excelente!;Nota 10! Queria agradecer a atenção de todos e em especial ao Colaborador Moisés. Nota 1000.....seria muito bom se encontrássemos sempre pessoas como este rapaz....que faz tudo com presteza e amor. Um grande abraço a todos
586;15 de junho de 2018;50;Ótimo atendimento!;Todos os funcionários são muito atenciosos, o ambiente é muito agradável e a comida maravilhosa! Recomendo
587;15 de junho de 2018;50;Qualidade;Ótimo atendimento, e tudo feito com total qualidade, parabéns a todos funcionários e principalmente aos gerentes q são todos muito atenciosos
588;15 de junho de 2018;50;Maravilhoso!!!;Excelente! Atendimento impecável. Todos os funcionários são muito atenciosos. A comida sem o que falar, maravilhosa!
589;15 de junho de 2018;50;Passeio na chimarron;A churrascaria mais TOP de JUIZ DE FORA. Você quer um lugar tranquilo para conversa sobre negócios, passeio familiar ou um passeio romântico pode ir direto na chimarron outro lugar não tem igual isso eu garanto ok podem confiar
590;14 de junho de 2018;50;Adorei;Atendimento muito bom, carnes e guarnições muito saborosas!!!!!! Vale a pena conferir!!!!!! O preço é que poderia ser um pouco mais acessível
591;14 de junho de 2018;40;Muito bom!!!;Ótima churrascaria, só gostaria de um pouco mais de variedade de carnes. Mas o atendimento é perfeito.
592;12 de junho de 2018;50;Excelente;Tem um excelente atendimento, ambiente tranquilo,comida excepcional, todas as vezes que vou sou tratada muito bem
593;12 de junho de 2018;50;Conseguiram melhorar o que já era ótimo;Fizeram algumas ótimas alterações no menu de saladas que agora oferece mais opções e saladas com melhores sabores. No restante continua tudo Excelente, só sinto falta de alguns cortes especiais como ojo de bife e carnes nobres como wagyu.
594;11 de junho de 2018;50;Excelente;Como sempre arrasando! Ambiente tranquilo, confortável e agradável! Super recomendo! Não tem igual...
595;11 de junho de 2018;50;AMBIENTE AGRADÁVEL;Local agradável para apreciar uma variada mesa de frios e ótimas saladas , também um bom atendimento e ótimo local para festejar com a família.
596;7 de junho de 2018;50;Lugar top;Foi minha primeira vez na ksa e irei voltar em breve atendimento nota 1000 muito atenciosos em TD super indico
597;26 de maio de 2018;40;Almoço de domingo;Ótimo custo-benefício , ambiente agradável e carnes com alto padrão além da mesa de frios farta! Bem localizada e ótimo atendimento.
598;22 de maio de 2018;50;A melhor churrascaria rodízio;A Chimarron busca a excelência em tudo, desde a espera do cliente até o pagamento da conta. Um lugar onde vc é muitíssimo bem servido, além disso tudo é de excelente qualidade e não fica a dever em nada às melhores churrascarias do país....
599;18 de maio de 2018;40;Muito Boa;Exelente atendimento, comida boa, lugar agradável. Só que depois de um tempo , eles param de servir...e não entregam a comanda do Japonês mais. Se não fosse por isso seria nota 10. Então classifico como 9.
600;16 de maio de 2018;50;Nota 10, excelente!;A tempos que conheço a churrascaria Chimarron, e a mesma continua com o alto padrão de qualidade. Um serviço excelente, profissionais preparados, tudo nota 10. Parabéns ao estabelecimento. Em Juiz de Fora não arrisco ir em outra churrascaria.
601;16 de maio de 2018;40;Caríssimo.. mas excelente comida;Atendimento, ambiente e comida excelente. O valor é totalmente absurdo. 50 reais estava justo.na crise em que vivemos não posso voltar nesse valor. Deveria pelo menos, aegunda e terça ou final de mês ter uma promoção casal não sei..
602;15 de maio de 2018;50;A melhor opção em churrascaria;Tudo muito bom, ambiente tranquilo aconchegante espaço otimoo atendimento excelentíssimo todos os funcionarios muito educados prestativos sempre buscando o bem estar dos clientes sai de lá satisfeito diferencial essa e a palavra certa para descrever a Chimarron churrascaria
603;13 de maio de 2018;40;preço alto;Achei o ambiente perfeito mt agradavel,equipe super atenciosa,otimos garçons.porem achei o preço muito alto pelo que consumimos,infelizmente nao e um ambiente que podemos frequentar semanalmente por causa do alto valor.
604;13 de maio de 2018;50;simplesmente perfeita!;Como sempre, atendimento e qualidade nota 10!!! Só o preço.. nem tanto... Podia ter algum tipo de desconto para família (com 4 ou mais pessoas , por exemplo)
605;12 de maio de 2018;50;Perfeito!;Minha primeira visita! O preço me assustou no início mas logo percebi que compensa bastante, fui servido ininterruptamente e a comida é muito variada e saborosa.
606;11 de maio de 2018;50;Atendimento de qualidade!;Garçons super educados e atenciosos no atendimento, além de um churrasco delicioso e uma comida japonesa irresistível, muito top, super indico.
607;11 de maio de 2018;50;Melhor churrascaria da região;Lugar agradável, ótimo atendimento, fácil acesso, amplo espaço, recomendo a todos a conhecer o ambiente.
608;8 de maio de 2018;50;Excelência no atendimento.;Parabéns aos garçons pelo atendimento e simpatia! Super diferencial e com certeza somado a qualidade que a casa nos proporciona,se torna um ambiente agradável e sempre temos prazer em voltar !
609;8 de maio de 2018;50;Melhor Churrascaria de Minas Gerais.;Uma experiência que todo apreciador de boa carne deveria viver. Atendimento excepcional e aquela picanha que você respeita!!!!
610;7 de maio de 2018;50;Muito bom;O ambiente é espetacular e a comida também, atendimento dos funcionários perfeito muito prestativos e atenciosos. Resumindo como sempre de parabéns
611;7 de maio de 2018;50;O melhor da cidade.;Fomos em comemoração do trabalho. E adoramos tudo, atendimento, opção de self-service ( japonês, ovinhos de codorna, etc). No dia ainda tivemos o prazer de encontrar com o dos melhores sambistas.
612;4 de maio de 2018;50;Perfeito;Lugar muito agradável e atendimento realmente profissional, estão de parabéns e espero voltar muito em breve!!!
613;4 de maio de 2018;40;Carnes saborosíssimas;Gostei demais ótimo atendimento e qualidade. O preço é alto, porém vale a pena cada centavo pela qualidade e sabor de cada carne oferecida.
614;3 de maio de 2018;50;Melhor Impossível;Muito bom, ótimo churrasco, ambiente muito agradável, atendimento muito rápido e todos solícitos!!!!
615;2 de maio de 2018;40;Muito bom.;Muito bom o atendimento. Alimentos de boa qualidade e variedades. Preço um pouco salgado. A Churrascaria precisa diversificar as promoções.
616;2 de maio de 2018;40;otimo;exelente comida lugar agradavel atendimento muito bom preço um pouco elevado mas de acordo com o lugar
617;2 de maio de 2018;50;bem atendido, carnes de primeira;oferecer as carnes mais nobres, muita gente não sabes das melhores. Como costela uruguaia, red angus, chouriço argentino entre outras
618;30 de abril de 2018;50;Top top. Carnes de primeira! Atendimento maravilhoso;Sensacional. Vale a pena o preço pago. Adorei tudo! Tudo muito bem feito! Eu amei! Vale a pena conferir! Super indico
619;30 de abril de 2018;50;Churrasco rodizio de primeira;Carnes de ótima qualidade e variedades, muito bem servido ,equipe muito engajada para nós fazer o melhor. Recomendo e o preço é justo.
620;29 de abril de 2018;50;serviço excelente;ótimo ambiente, qualidade nota 10, internet muito boa e gratuita, banheiros excelentes e por fim bem localizado
621;28 de abril de 2018;40;Muito bom;Churrascaria com muitas variedades de pratos e carnes gostosas e bem preparadas. Garçons atenciosos!!
622;27 de abril de 2018;50;SATISFAÇÃO;bom atendimento , muito eficaz , boa comida , bom tratamento para crianças , ambiente agradavel , preço justo
623;25 de abril de 2018;50;Espetacular!;Ambiente agradável e familiar. Carnes nobres e de muita qualidade. Atendimento impecável. Com certeza voltarei.
624;25 de abril de 2018;50;Maravilhosa Churrascaria, Chimarron .;A Melhor Churrascaria de Juiz de Fora. Completa, no quesito comida de primeiríssima qualidade, atendimento nota mil de todos os funcionários . Recomendo Sempre.
625;24 de abril de 2018;50;Excelência;Eu e meu esposo fomos pela primeira vez e ficamos encantados com o atendimento. O churrasco estava uma delícia, assim como a comida japonesa. Voltaremos sempre!
626;24 de abril de 2018;50;Atendimento perfeito!;Estive na churrascaria no dia 21/04 com meu marido e fomos muitíssimo bem atendidos. Ponto positivo p/o feeling dos garçons que mesmo quando viramos a plaquinha para
627;22 de abril de 2018;50;Excelência em atendimento equalidade;Adoramos o atendimento e a qualidade da comida! Todos os funcionários estão de parabéns por se preocupar com o bem estar dos clientes!
628;20 de abril de 2018;50;Chimarron Churrascaria;Excelente atendimento, fomos bem servidos, comida muito bem feita, garçons educados e atenciosos, nada a reclamar. voltaremos mais vezes!!
629;17 de abril de 2018;50;Tudo ótimo;Lugar maravilhoso, ótimo atendimento e comida de primeira. Parabéns a toda a equipe. Fui pela primeira vez e pretendo voltar muitas vezes.
630;17 de abril de 2018;50;Show!;Muito bom o lugar...o atendimento e o mais importante é a comida....o preço poderia ser melhor .... aí iríamos mais vezes. Parabéns
631;17 de abril de 2018;50;Top;Top muito bom o atendimento estão de parabéns lugar muito bom de qualidade . Assim que estiver em juiz de fora estarei de novo no estabelecimento
632;16 de abril de 2018;50;Melhor rodízio de Juiz de Fora;É o melhor rodízio de Juiz de Fora e um dos melhores do Brasil. Carnes deliciosas, acompanhamentos excelentes, comida japonesa muito boa! Recomendo!!
633;16 de abril de 2018;50;Maravilhoso;Restaurante magnifico, comida maravilhosa com espaço Kids com visão ótima. Sem comentar o serviço perfeito fui muito bem assistida por tds.
634;13 de abril de 2018;50;Muito Bom!;Ótimo atendimento e carne de qualidade! Nada a reclamar. Pra finalizar o doce então nem se fala! Tudo perfeito!
635;12 de abril de 2018;50;Ótimo;Mto bom , comida maravilhosa e para as crianças o melhor ambiente! A melhor de Juiz de Fora sem dúvida!
636;11 de abril de 2018;50;Ótimo serviço!;Excelente serviço, fomos bem servidos, comida saborosa,ótimo atendimento, sem contar as carnes que são de primeira qualidade!
637;11 de abril de 2018;50;Fantástico;Atendimento de alto nível, desde o dia da reserva até o dia do evento. As acomodações foram perfeitas, atendimento de excelência.
638;10 de abril de 2018;50;Ótima experiência!;Buffet ótimo, tudo de qualidade, atendimento excelente. Espero voltar muito em breve! Recomendo a todos!
639;10 de abril de 2018;50;Ha tempos vivia sonhando com o dia que na Chimarrom.;Sempre ouvi excelentes comentários a respeito do hambiente. Foi uma experiência incrível que jamais esquecerei e muito em breve irei repetir. Lugares assim são raros nos dias atuais....quero parabenizar vocês pelo atendimento,comodidade e pelos deliciosos petiscos... Amei!!!
640;9 de abril de 2018;50;Excelente;Restaurante excelente, a melhor churrascaria de Juiz de Fora. Equipe excelente, com muitas opções de carne, salada e comida japonesa. Porém a grande especialidade é onde se encontra a maior qualidade, o churrasco bem preparado e bem servido.
641;5 de abril de 2018;50;Excelente!!!;Nada a reclamar, as poucas vezes que estive lá, estava tudo ótimo, o atendimento, a comida em geral, a recreação para as crianças, o ambiente, a higiene, não tem nada o que melhorar, está tudo ótimo!!!
642;4 de abril de 2018;50;Serviço pefeito;Excelente, serviço muito bom, todos educados e cordiais. Carnes nobres e com muita qualidade. Pratos frios também de ótima qualidade e fartos.
643;2 de abril de 2018;50;Avaliação qualitativa;ótimo atendimento o que é ruim a espera em filas. já desisti muitas vezes principalmente com idosos e crianças
644;2 de abril de 2018;50;Como Sempre;Ótimo como sempre, o atendimento impecável, o ambiente muito aconchegante, e a comida maravilhosa, como sempre.
645;1 de abril de 2018;50;A melhor;Indiscutivelmente é a melhor churrascaria da cidade, que já acompanha a tendência moderna de casas semelhantes e ampliou seu menu para os peixes, frutos do mar e comida japonesa. Vale a pena.
646;1 de abril de 2018;50;Melhor churrasco de Juiz de Fora;A churrascaria Chimarron oferece um ótimo serviço e conta com uma excelente variedade de carnes e frios, além de um rodízio de comida japonesa delicioso. Os funcionários sempre são bem atenciosos e educados!
647;29 de março de 2018;50;Churrascando em Juiz de Fora;Ótima churrascaria: bom atendimento, carnes nobres e saborosas, ambiente super agradável. Estacionamento proprio, gratuito e coberto. Preços compatíveis com a qualidade dos produtos e serviços. Serviço de self-service com rodizio de carnes, incuindo, a culinária japonesa. Recomendo!
648;28 de março de 2018;50;Churrasshow;Melhor carne, mesa de frios excelente, serviços,simpatia dos funcionários,ambiente agradável, estacionamento.
649;27 de março de 2018;50;Melhor churrascaria da região!;Experiência incrível, carne da melhor qualidade, atendimento excelente e ótimo preço. A localização é muito boa e o ambiente é muito agradável também.
650;27 de março de 2018;50;EXCELENTE !!!;Uma das melhores churrascarias que já tive o prazer de frequentar !!! Atendimento nota dez !!! Comida então... TUDO é excelente !!! Dica: Cheguem cedo pois fica fila de espera ...
651;26 de março de 2018;50;Ótima churrascaria;Boa tarde! local bacana para ir tratar de negócios ou família independente da visita que forem fazer passou por Juiz de fora vão la na Chimarron.
652;22 de março de 2018;50;Fenomenal;9.8 Churrascaria sensacional... variedade de carnes e atendimento especial, além de diversos tipos de comidas, dentre elas, japonesa. Sucesso total.
653;19 de março de 2018;40;Lucal agradável;Chimarron Churrascaria é um local agradável, bom para grupos de amigos ou com a família. Tudo de bom mesmo.
654;18 de março de 2018;50;Adorei!;A indicação foi da funcionária Rafaela da recepção. O maitre e os garçons muito educados e simpáticos. Fiquei muito satisfeita!
655;18 de março de 2018;50;EXCELENTE;Um lugar maravilhoso para almoçar com a família. Um excelente espaco kids o que sempre torna meu almoço mais agradável. Ótimo atendimento. O preço é bastante salgado porém compensa a qualidade da comida.
656;17 de março de 2018;50;1ª escolha!;Não tem como pensar em rodízio e não fazer a escolha pela Chimarron, como sempre de 1ª qualidade. Fui e volto sempre.
657;17 de março de 2018;50;Muito bom!;Primeira vez, achei muito bom. Atendimento nota 10 . Pessoal muito atencioso. Varias tipos de carnes nobres . Japonês nota 10 sashimi nota 10
658;16 de março de 2018;50;Melhor de Jf;Ótima churrascaria, todos os garçons muito atenciosos e rápidos. Tudo perfeito, comida maravilhosa,carnes ao ponto, com delicioso tempero.
659;15 de março de 2018;40;Otima avaliação;Um atendimento otimo, garçons muito atenciosos e prestativos, foi maravilhoso. Unica coisa que não foi 100% satisfatória foram as carnes que pararam de passar depois de um tempinho, mais tirando isso daria a avaliação total. Parabéns pelo ambiente.
660;15 de março de 2018;50;Excelente.;Um ótimo lugar. Cardápio e equipe muito bem escolhidos, ambiente tranquilo, boa seleção de carnes e de buffet. Parabéns!
661;14 de março de 2018;30;Comemoração Dia das Mulheres;O atendimento dos garçons foi excelente, mas a parte de pagar a conta... Qta confusão! Sumiram com minha comanda, esperei 15 minutos para ser atendida, não tinha nenhuma organização no Caixa.
662;13 de março de 2018;50;Excelência em Carnes;Ótimo ambiente, garçons muito atenciosos e generosos, comida de ótima qualidade e tempero, além de uma excelente e nobre variedade de carnes!!!!
663;13 de março de 2018;40;Carnes de qualidade!;Ótimo atendimento e carne de primeira. Acho que a sobremesa poderia ser incluída no valor do rodízio.
664;13 de março de 2018;50;Carnes de nível top;Não perde nada para churrascarias famosas dos grandes centros. Comida e atendimentos nota 10. Sempre muito bom.
